IP,Port,Device,Banner,Timestamp,Hostnames,Country,City,Operating System,Organization
221.205.11.243,469,"Server1","Policy peace travel each gun instead.",2023-01-06T09:11:18.520186,lt-39.james-sullivan.org,Mexico,South Kaylafurt,former,Ernst & Young
151.124.233.9,330,"Server99","When feel vote point know often wish week.",2023-08-11T00:27:03.876296,desktop-67.hart-brown.info,China,Raymondton,debate,Apple
120.244.229.132,450,"Server48","Wonder exactly field series north unit about.",2021-11-12T18:19:23.645346,srv-91.jones-jordan.com,Japan,Danielberg,trial,Mercedes-Benz
154.192.157.207,385,"Server75","Someone country unit meet feeling.",2023-06-27T19:15:08.243724,srv-79.evans.net,Israel,South Robert,fish,Oracle
122.232.0.78,509,"Server81","Reason good newspaper page inside woman from.",2023-02-27T22:27:53.246837,laptop-45.harris.com,Chile,Jamieton,term,Sony
36.222.237.224,466,"Server31","Happen act story outside deal.",2021-04-26T03:59:44.287732,desktop-13.gutierrez.com,Israel,Sarahside,recently,Morgan Stanley
147.104.43.89,534,"Server64","Machine ago charge training drive.",2023-09-20T01:05:39.598195,db-19.wright.com,Chile,Thomasshire,who,Oracle
169.38.128.144,205,"Server67","Maybe outside situation that democratic environmental exist.",2023-11-26T18:43:14.164170,lt-36.ramirez-murray.com,Egypt,Deborahhaven,there,Samsung
168.241.1.39,339,"Server82","Voice son indicate eye.",2024-03-31T04:54:22.286535,web-21.sanchez-black.com,Egypt,Tiffanyborough,go,Accenture
12.255.124.192,438,"Server46","His anything air always.",2023-11-04T11:15:47.931736,srv-46.escobar-nichols.com,Russia,Port Joshua,month,Oracle
112.223.14.205,279,"Server2","Population high dark produce Mr size.",2024-03-18T01:07:29.387335,db-89.sherman-nicholson.com,Mexico,South Malik,character,Siemens
106.37.45.33,459,"Server82","Hotel use cause clear great.",2024-06-16T20:50:51.028019,web-27.perez.com,Mexico,Zacharymouth,film,Sony
164.120.225.46,307,"Server54","Return hand but worker nature.",2024-05-05T17:56:03.535069,db-36.jones-holt.com,Argentina,Adamsside,executive,Amazon
199.24.167.30,227,"Server78","Student memory draw campaign yourself.",2023-11-05T15:12:59.420836,lt-15.powell.info,China,Lake Anna,inside,Ernst & Young
222.103.173.192,403,"Server69","Reality level shake.",2023-12-19T07:53:49.689273,lt-74.gonzales-snow.com,United Kingdom,Port Jeannebury,entire,Goldman Sachs
4.213.47.0,309,"Server77","Same prove think big dream never maintain.",2020-03-14T10:28:49.436833,laptop-01.lopez-ryan.com,Mexico,Mcgeeberg,one,Huawei
181.241.115.143,307,"Server9","Once trade letter staff.",2021-04-29T13:13:16.954857,email-08.prince.com,Egypt,North Sethfurt,kind,Google
154.99.7.23,531,"Server34","Stage note state customer become total relate.",2024-11-25T04:26:44.996591,web-69.byrd-curry.com,Indonesia,South Debra,issue,General Electric
87.155.199.123,352,"Server95","Production education usually.",2021-07-04T08:06:19.185495,laptop-08.deleon-stephens.com,Brazil,Phillipsshire,owner,Goldman Sachs
91.114.138.246,347,"Server32","Toward describe prevent rise us magazine.",2021-05-22T21:07:11.908178,email-34.wolf.com,Japan,Mathisport,face,Accenture
169.93.13.239,584,"Server23","Well receive that yard green stage accept.",2020-08-29T09:50:49.858284,db-05.hines-martinez.com,Saudi Arabia,Millertown,speak,Samsung
61.173.61.8,286,"Server4","Exist unit visit later day worker film reason.",2021-08-18T16:54:20.761341,web-31.lynn.com,South Korea,Brittanyport,account,HSBC
190.41.213.103,495,"Server36","Body truth term pressure enjoy budget although federal.",2020-04-27T04:51:45.771384,desktop-35.clark.biz,Russia,Port Julietown,four,Huawei
170.167.167.221,373,"Server96","Remain citizen once environment tell believe its.",2022-06-25T08:57:27.837500,desktop-10.smith-martin.org,Bangladesh,New Katherine,including,Siemens
96.162.203.63,599,"Server29","Season would point we pay night feeling.",2021-09-06T12:56:25.517569,email-08.chen-hansen.net,France,Christopherfort,American,BMW
163.5.254.156,510,"Server18","Send level imagine way.",2022-03-24T00:09:24.831359,desktop-77.jordan.info,United States,Monroechester,member,Volkswagen
40.45.154.68,246,"Server78","Husband here large process.",2020-10-24T23:19:02.861694,laptop-69.torres.com,Spain,Kevinchester,local,PwC
141.145.105.236,385,"Server39","Thought approach open job control.",2023-06-16T22:21:50.769486,desktop-25.vaughan-richardson.com,Egypt,Walkermouth,good,Google
39.141.182.95,298,"Server93","Analysis kind develop series culture.",2024-02-18T16:32:41.630142,web-08.rogers-fisher.com,Indonesia,North Andrew,partner,Deloitte
13.7.166.159,530,"Server31","Financial itself citizen maybe staff poor candidate night.",2021-03-05T02:16:23.343586,web-48.carter-brown.biz,Pakistan,Lake Richardshire,media,BMW
148.46.81.103,515,"Server23","Though year between behavior practice reality friend.",2024-09-20T08:23:36.577350,desktop-33.livingston.org,Argentina,New Kaitlinside,main,Samsung
98.37.36.21,531,"Server42","Main wear phone country evening lay different value.",2021-03-08T10:03:27.592100,web-41.howard-sullivan.com,Israel,North Lindsey,himself,Tesla
33.50.168.9,386,"Server3","Owner operation reduce very.",2021-02-22T14:53:36.323897,srv-98.hensley-hogan.com,Chile,Markfurt,for,KPMG
216.17.229.21,545,"Server90","Before message toward history director subject.",2024-07-17T16:33:16.113461,email-62.stone.com,South Korea,North Erikaland,employee,IBM
214.38.195.243,466,"Server78","It two quickly there leader easy agency.",2021-08-14T07:58:07.927224,db-64.williams-collins.org,Indonesia,West Latashafurt,consumer,HSBC
22.249.75.53,467,"Server92","Force animal American blue budget soldier.",2023-07-24T19:39:32.759056,web-39.castro.org,Italy,West Christinehaven,left,IBM
217.235.14.246,553,"Server71","Identify lay decade eat large.",2021-01-10T01:13:29.664322,laptop-58.yates-wise.org,Argentina,Port Jamesbury,ok,Apple
101.23.152.23,562,"Server92","Television end executive pass particular old nation.",2023-06-30T01:38:28.701609,lt-13.kaufman.com,Turkey,Corymouth,eye,BMW
80.33.111.33,552,"Server49","Meeting race every near say.",2024-01-04T16:29:32.511104,desktop-99.gregory.biz,Kenya,Nicoleport,tough,Google
35.69.90.46,497,"Server97","Who beyond expert election fight real.",2020-08-07T09:03:22.586664,srv-22.freeman-griffith.com,United States,East Linda,still,PwC
56.90.51.97,227,"Server14","Different feel create season spend.",2020-11-22T05:16:49.092335,laptop-52.anderson-beck.com,France,Patrickton,few,BMW
129.187.159.206,261,"Server35","Total turn large continue develop suddenly.",2023-03-07T11:07:08.114876,srv-77.jordan-bradley.info,Egypt,Edwardsfort,total,Apple
87.209.108.2,453,"Server67","Police character within watch watch.",2024-01-12T05:15:41.511679,web-81.barnett-mcguire.info,Spain,Davidmouth,indeed,Sony
8.243.57.53,267,"Server9","List south receive officer push face.",2023-12-08T23:02:44.222943,desktop-55.ramirez.com,Spain,New Christopher,draw,Amazon
17.139.92.125,442,"Server53","Represent see low especially affect so treatment.",2023-05-31T16:27:23.521888,email-94.wright.net,United States,East Marcport,set,HSBC
212.2.123.137,372,"Server97","His that experience employee beyond.",2021-03-08T03:33:11.435340,srv-37.thomas.com,Egypt,Chelseaport,cup,PwC
40.75.230.124,441,"Server57","Yard eight parent fast.",2024-05-21T18:49:40.445614,web-19.stewart.biz,Saudi Arabia,South Patricia,executive,Google
205.116.147.250,477,"Server44","Both prepare eight.",2020-03-07T09:25:22.924620,srv-31.massey.com,Germany,Cantrellhaven,mission,Accenture
91.26.145.59,434,"Server51","Store to candidate week suffer.",2023-01-10T05:13:39.808685,srv-22.king.org,South Korea,Nicoleshire,throughout,Apple
81.32.75.219,381,"Server60","Suggest soon appear assume far eye view talk.",2020-09-04T17:51:00.993341,web-60.king-bishop.com,Russia,Ianside,whole,Citigroup
57.117.35.19,474,"Server13","Usually body sister no far fly write once.",2022-08-04T10:54:16.732821,lt-27.neal.com,Italy,Patrickmouth,city,HSBC
99.81.9.40,289,"Server12","Per remember many.",2024-09-09T00:25:32.519966,laptop-40.alvarez.info,Mexico,New Christopher,room,Citigroup
214.116.246.132,206,"Server93","Feeling mission financial man until position kid.",2024-11-24T13:47:03.276194,srv-28.rios.com,Pakistan,Ericview,Mr,Microsoft
45.253.74.91,326,"Server60","They paper summer report PM.",2022-06-09T05:01:09.254999,db-75.duarte-montoya.com,Russia,Marshallhaven,which,Mercedes-Benz
207.237.230.141,468,"Server71","Hear control knowledge cost.",2021-10-23T21:05:33.319527,db-24.rodriguez.com,United Arab Emirates,Jillianport,after,Deloitte
135.68.43.243,277,"Server51","Police skin camera.",2022-05-08T19:01:50.638944,srv-07.montgomery-martinez.com,United States,New Melaniestad,yourself,Deloitte
185.75.40.3,502,"Server28","Morning future north board.",2021-10-09T01:50:53.383263,srv-26.patrick.biz,Israel,Lake Edward,article,Oracle
45.127.53.171,594,"Server68","Debate career arm.",2021-08-15T07:48:43.633975,desktop-64.martin.com,Chile,Mendezborough,investment,Facebook
42.242.176.115,473,"Server86","Practice lose take.",2022-02-17T10:48:07.748474,srv-74.stewart.com,Canada,North Cynthia,eight,Samsung
15.85.125.39,371,"Server4","Five paper week none serious.",2022-01-14T23:50:34.785094,srv-97.mann-lynch.com,China,Toddtown,blue,Sony
21.76.224.138,208,"Server14","Always move walk down grow firm.",2023-05-16T00:09:55.131935,db-14.garza-harrison.com,Brazil,South Frederickton,tonight,IBM
215.63.72.21,544,"Server62","Exist under operation however radio yourself.",2021-08-13T23:20:01.562318,db-81.hernandez.com,Kenya,Jacobsfurt,near,IBM
118.91.151.159,274,"Server59","Fact forward paper daughter fast.",2020-07-02T11:43:49.613953,web-67.macias.biz,Turkey,Scottstad,history,KPMG
144.77.139.207,284,"Server70","Foot race couple lay well example end late.",2020-12-18T23:49:32.281789,laptop-90.mack.net,Australia,Cheyennebury,region,Siemens
194.248.215.108,273,"Server5","Similar partner effect reason military we.",2024-05-10T16:46:26.758317,desktop-45.martinez-soto.com,China,Lake Lisaport,foreign,Amazon
53.34.2.105,484,"Server21","Memory good scientist government.",2023-07-23T06:21:13.889571,desktop-67.walter.com,United States,Jenniferhaven,art,Sony
14.1.211.67,555,"Server37","We player girl throughout indicate type more.",2021-08-28T02:55:01.983234,db-29.sanchez.com,United Kingdom,Markburgh,enjoy,Goldman Sachs
126.2.5.103,576,"Server1","Prove fund every with everybody night cold.",2023-07-21T19:03:03.931480,db-99.skinner-griffin.com,Canada,Kennethville,interesting,Goldman Sachs
1.247.111.237,506,"Server52","National agency require expect alone there.",2020-06-27T06:59:30.026617,lt-55.willis.com,Brazil,East Connie,whole,JPMorgan Chase
90.233.23.152,203,"Server48","Level he three project any assume.",2023-06-21T13:59:29.873971,web-37.phillips.org,Argentina,Henrybury,ball,Intel
74.194.255.248,226,"Server78","Charge sell home matter structure we.",2020-01-19T04:36:07.679668,srv-87.jones-perez.com,Pakistan,New Dustin,reduce,Volkswagen
61.29.141.93,227,"Server70","Environmental local writer inside wrong.",2020-02-21T22:43:26.983223,lt-41.alvarez-lee.com,Australia,Jillianburgh,sell,Ernst & Young
77.6.212.192,556,"Server54","Decision research avoid each live.",2024-11-20T19:33:08.490443,email-41.moore.com,Kenya,Martinbury,soon,IBM
117.138.172.46,256,"Server1","Fall practice body.",2024-08-05T08:57:36.232806,web-79.acosta.com,France,West Kathleen,board,Facebook
137.16.177.136,386,"Server23","Want stand camera various.",2023-07-06T02:59:46.784553,db-08.lara.com,Nigeria,Yoderside,hot,Mercedes-Benz
176.99.215.99,384,"Server39","Much own to.",2020-04-22T18:23:06.431041,db-38.cook.info,Australia,Lake Keith,include,JPMorgan Chase
18.26.236.187,232,"Server62","Movie sell everyone wife allow know onto.",2021-07-15T17:48:57.467457,desktop-44.morrison-hernandez.org,China,Meghanmouth,your,KPMG
115.201.100.128,361,"Server83","Next particularly special wrong rather.",2022-05-30T21:49:29.137706,web-36.woods.com,Pakistan,South Amanda,medical,Huawei
89.68.147.188,383,"Server44","Parent image because help arrive outside yeah.",2020-12-21T05:48:16.467347,email-82.pitts-blanchard.biz,Russia,Camposbury,food,Barclays
209.133.207.162,311,"Server57","Least site bring too represent.",2024-08-11T12:11:48.753412,web-36.gray-smith.com,Spain,North Austin,occur,Siemens
220.140.19.14,329,"Server80","Plan resource item.",2023-04-07T09:18:27.246772,db-48.yoder.com,Thailand,Paulland,doctor,Microsoft
147.110.90.224,307,"Server25","Beat think class professional build while difficult few.",2023-07-26T15:11:37.015473,srv-19.snyder.com,Israel,Emilyburgh,position,Goldman Sachs
150.192.102.197,548,"Server9","Up important wind case officer.",2024-03-17T11:23:37.224881,db-68.snyder-oliver.com,Argentina,Wrightborough,hospital,Samsung
24.70.188.223,568,"Server57","Itself thousand employee.",2022-12-19T03:29:35.430248,email-71.williams.net,Germany,West Austinmouth,far,Google
174.89.114.42,264,"Server4","Ten board lead recently.",2022-05-02T07:11:46.270453,email-41.howard-watkins.biz,Egypt,Myersville,which,General Electric
110.181.193.48,556,"Server80","No human deep turn city.",2021-09-30T09:07:53.668366,lt-27.costa-anderson.com,Japan,Reesemouth,base,Citigroup
8.11.69.196,479,"Server38","Blood skill imagine page oil team.",2020-06-14T12:07:31.676742,desktop-25.gonzalez-ponce.com,Thailand,Adriantown,carry,Amazon
132.92.78.104,576,"Server71","Statement nearly knowledge yes civil early.",2024-08-21T21:57:28.846688,web-20.hunter.com,South Africa,New Bridget,especially,Goldman Sachs
68.237.183.57,589,"Server61","Town seem surface bring under play.",2020-02-14T03:28:39.388509,lt-26.pennington.com,United Arab Emirates,North Philipmouth,card,Google
181.193.165.180,295,"Server100","Performance often kid fall.",2023-04-21T04:23:02.552679,lt-47.cowan.org,Mexico,Danielport,popular,Microsoft
40.196.92.16,378,"Server99","Likely certain free during.",2023-01-26T00:25:41.662815,desktop-63.armstrong.com,Germany,Gregoryhaven,for,BMW
149.106.193.197,214,"Server53","Keep part yes follow north never direction.",2024-07-31T08:11:53.557425,laptop-35.scott.net,United Arab Emirates,Downsview,sit,Google
105.17.232.171,365,"Server99","More chair region.",2022-06-29T01:08:19.679908,email-45.chen.com,India,Emilyfort,send,JPMorgan Chase
22.33.142.24,454,"Server69","Risk student room.",2023-09-08T09:57:03.441641,web-02.perez-silva.com,Italy,Stevenbury,over,Sony
4.230.198.148,549,"Server72","Discussion student appear unit pull inside.",2021-05-28T17:33:19.259896,srv-10.ward-fields.com,Indonesia,New Marisatown,strong,Sony
71.139.145.60,274,"Server11","Issue director contain operation wear.",2023-06-11T21:03:45.394425,email-34.armstrong.com,Italy,Aprilside,understand,HSBC
190.208.23.142,470,"Server60","Week though would stay.",2024-12-06T21:03:24.942384,laptop-19.wang-moore.net,Israel,Port Caroline,case,Toyota
180.37.222.226,240,"Server4","On put money cell little.",2024-10-03T13:45:01.508522,laptop-78.chaney.com,Argentina,Wagnerville,senior,Barclays
24.36.21.117,362,"Server7","Admit couple generation trial.",2021-05-24T22:07:01.857965,srv-04.graham.biz,Canada,Adamsville,when,Intel
98.20.41.52,267,"Server47","Pick certainly together house.",2023-07-18T06:36:45.658737,desktop-13.savage.org,Brazil,Port Karen,car,Citigroup
199.172.150.73,374,"Server75","Source rate week program.",2023-04-04T09:35:17.641981,lt-70.palmer-miller.biz,Brazil,North Tanyatown,step,Citigroup
146.123.80.45,346,"Server32","So air plant radio at gas we however.",2022-12-24T13:33:59.420457,db-26.le-pittman.com,Italy,Josephberg,science,KPMG
84.237.4.172,270,"Server100","Director picture world television that.",2020-06-09T03:22:15.966132,db-13.schmidt.com,India,Wagnerton,north,Accenture
59.64.167.70,303,"Server99","Grow dark generation later bad air outside.",2022-11-19T04:48:18.671010,db-84.lynn-rosario.info,South Africa,Flynnview,church,Sony
6.55.113.247,537,"Server36","Several second food value.",2023-10-09T18:47:51.611153,db-66.rhodes.net,Vietnam,Michaelmouth,again,General Electric
41.191.188.44,328,"Server24","Road friend money bag article speech.",2023-10-31T05:06:54.111420,lt-04.johnson.com,Germany,Roblesshire,thus,Apple
11.25.56.242,223,"Server83","To mention commercial consider.",2023-08-18T05:47:50.953790,srv-05.lowe.com,Israel,Port Danielchester,pay,Mercedes-Benz
46.215.195.160,338,"Server55","Minute she realize dinner budget partner.",2021-12-02T18:02:51.538588,lt-08.thompson.com,China,Robertoview,maintain,Apple
151.6.77.140,508,"Server58","Image worker enough project collection out draw.",2021-06-09T16:36:11.484975,web-99.hurley.net,Israel,Scottbury,able,Siemens
170.238.155.17,442,"Server78","Language method fact fact leader part reason.",2023-11-11T13:13:05.551258,desktop-76.moody.com,Japan,Bethport,person,Ernst & Young
59.140.113.29,452,"Server26","Gun memory for everyone dinner.",2021-06-04T23:21:38.857283,web-51.johnson-brown.com,Spain,New Stephaniebury,level,Intel
130.83.149.208,276,"Server97","Democratic worry past west rock month.",2024-04-03T18:10:37.030175,srv-24.ross.com,Brazil,Carrbury,wife,IBM
212.166.29.158,368,"Server21","Several understand break seem.",2022-08-02T09:50:36.290807,email-07.johnson-lewis.biz,United Kingdom,Patrickberg,civil,KPMG
152.178.24.136,375,"Server34","Health charge say above.",2021-12-05T13:44:04.905638,laptop-22.coleman.com,Italy,Heatherchester,state,Tesla
24.199.97.16,354,"Server18","Few offer sell hard.",2023-01-04T02:22:35.665568,laptop-04.wood.com,United Kingdom,Williamsfurt,natural,Accenture
140.141.238.168,572,"Server99","Whole trip usually team which state if pattern.",2020-11-02T21:51:13.787648,lt-37.acosta.com,Turkey,Archertown,scene,Huawei
101.206.133.236,445,"Server20","Share car sense story.",2023-02-09T15:35:14.946199,laptop-31.simpson.com,Bangladesh,Jenniferhaven,describe,Barclays
110.53.20.114,326,"Server91","Firm girl though item tend yes.",2023-04-07T17:28:48.263849,web-81.smith.com,Brazil,Port Kellie,memory,Ernst & Young
141.144.5.177,468,"Server5","There character day.",2024-01-04T08:49:01.804985,db-77.sullivan.com,United States,New Nicoleberg,behavior,Siemens
143.48.158.13,221,"Server13","Structure success boy live she community show.",2021-09-02T21:31:37.009961,srv-95.ryan.com,Japan,Port Natalieton,mother,Google
70.163.129.68,274,"Server99","Grow support relationship gun reflect dark analysis.",2022-04-25T05:41:57.183373,laptop-68.roy-flores.com,Italy,Kevinview,really,Deloitte
19.234.102.155,573,"Server42","Know thousand fact list my.",2023-03-17T01:39:59.076681,db-50.chen.info,Chile,New Jennifer,need,Intel
1.9.59.184,305,"Server66","Head imagine month audience ground cold soon.",2024-09-26T23:39:34.578685,email-06.farmer.biz,Egypt,North Connorton,hospital,IBM
75.15.87.41,378,"Server61","Husband up catch true.",2023-07-02T09:26:14.255838,laptop-95.jones-elliott.com,China,Garciaside,so,General Electric
60.87.243.178,578,"Server16","Pressure decade letter phone low require.",2020-08-14T15:47:58.279658,db-61.brown.com,South Africa,Jonathanport,person,Siemens
126.3.231.119,501,"Server8","Fear high air decade deep heart television.",2020-08-03T11:27:53.314171,lt-78.long.com,Italy,Grayland,later,Apple
142.180.94.72,459,"Server88","Control black real.",2022-11-05T22:55:34.642380,email-00.ibarra.com,France,Port Robert,interest,Apple
166.59.127.138,518,"Server60","Drive relate rich trade especially develop much organization.",2024-01-17T16:45:35.709840,db-67.rose-torres.com,Saudi Arabia,Lauratown,reduce,JPMorgan Chase
189.129.96.60,404,"Server97","Shoulder run sell enough everyone.",2020-08-13T08:07:17.155560,web-51.ramos.com,Indonesia,East Josephland,forget,Samsung
187.62.26.99,419,"Server47","Someone tree upon ask.",2024-05-26T12:05:56.199193,db-25.hunt-davis.com,Israel,Martinezfurt,generation,Samsung
79.210.161.127,304,"Server86","Art bag question out huge write food.",2021-02-08T10:55:03.024407,db-28.knight.com,India,Michaelville,she,General Electric
111.160.119.166,438,"Server56","Feeling air method indicate five teacher.",2024-05-17T19:46:18.405593,laptop-87.murphy-turner.com,Argentina,Christensenton,hope,BMW
72.124.203.86,205,"Server93","Product which girl but fund wonder produce.",2022-12-25T20:06:11.627181,srv-47.yu.com,South Korea,Gonzalezshire,letter,Sony
192.107.182.150,320,"Server15","Let little task PM challenge radio.",2021-06-13T03:18:06.930253,desktop-74.rocha.com,United States,Port Jasontown,father,IBM
82.180.45.220,241,"Server92","Exist participant paper middle prove.",2024-12-01T07:21:52.517506,laptop-81.taylor-bush.net,Mexico,Lake Christophermouth,entire,Ernst & Young
14.184.145.52,295,"Server49","Able something official half television.",2024-10-24T02:34:30.335338,db-19.tran.org,France,Port Robinstad,seem,Barclays
63.205.170.234,572,"Server95","Step along create know benefit affect protect.",2022-01-18T12:00:19.044967,web-46.barnes-gregory.info,United Arab Emirates,West Amanda,think,Barclays
91.218.191.103,304,"Server31","Relationship short admit and bed wonder sell.",2020-09-27T02:29:01.770444,laptop-19.mitchell.net,Israel,South Brentborough,traditional,Amazon
74.114.41.96,563,"Server72","True wall people up manage indicate.",2021-06-04T21:21:21.218333,web-55.ortiz.com,India,Lake Justinland,top,HSBC
165.110.180.125,435,"Server6","Father work woman police skin ago.",2023-07-26T00:46:22.645693,desktop-61.thomas-woods.com,Israel,Hickmanborough,on,Siemens
154.21.16.144,385,"Server65","Side song determine group figure include hospital.",2023-10-22T10:43:45.904982,email-18.roberts.com,Egypt,Lake Patricialand,mind,Toyota
215.147.93.50,365,"Server95","American herself strategy hope federal.",2020-09-19T19:51:33.071605,lt-44.thompson.org,Indonesia,Port Corey,at,Barclays
31.30.82.178,221,"Server82","Ten goal draw contain.",2024-01-03T11:21:15.078590,desktop-31.henry.com,Bangladesh,West Seanfort,affect,Toyota
53.166.32.35,530,"Server2","Dark military line news.",2021-04-30T22:26:44.907493,db-01.lee.com,Canada,West Reneeberg,result,Apple
16.88.201.58,375,"Server21","Bar rest take wide describe sea ground lay.",2024-02-05T11:53:36.609764,email-68.brock.info,France,Doyletown,quite,IBM
98.212.149.102,236,"Server47","That claim support program through.",2024-11-14T00:40:47.200184,lt-72.duncan-bell.com,India,Prattbury,discussion,Ernst & Young
135.97.134.44,488,"Server54","Skin strong will easy skill people wonder.",2022-08-28T23:30:10.747586,laptop-03.hendrix.com,Pakistan,North Miguel,picture,HSBC
28.28.123.248,568,"Server40","Product themselves over why door president model.",2021-09-09T13:18:20.858761,desktop-67.mccormick.com,United Arab Emirates,Jonesland,key,Sony
18.118.197.130,554,"Server69","Body no task sign perform maybe understand.",2024-09-12T13:01:55.300591,db-03.collins.biz,Chile,Ramirezchester,performance,Cisco
59.194.179.12,535,"Server13","Such pressure him.",2021-06-03T00:14:48.444310,srv-48.rodriguez.info,Argentina,Harttown,forget,Microsoft
209.253.128.107,497,"Server5","Movement coach marriage kid lawyer consumer help physical.",2024-11-05T19:55:53.412741,srv-54.koch-horn.com,Canada,Jamiebury,technology,Apple
105.17.139.122,414,"Server22","But national including model read.",2021-10-23T11:45:41.256310,web-79.mclaughlin.com,Japan,Smithborough,run,BMW
208.131.18.65,206,"Server71","More media pass.",2022-06-04T03:34:28.293945,srv-08.daniels.com,Turkey,New Petertown,green,Samsung
14.190.103.1,271,"Server2","It head stand outside start mission.",2023-02-03T12:57:09.029749,lt-22.stevens.info,Turkey,Jacksonchester,old,Cisco
216.57.221.185,215,"Server76","Director machine apply bill after religious read decade.",2022-10-06T19:23:11.742419,email-16.santos.com,United States,New Destiny,history,Intel
191.135.226.234,560,"Server30","Look she tonight tell station.",2024-11-29T12:15:40.594819,laptop-16.rodriguez-mitchell.net,Argentina,Krystalburgh,use,Apple
149.44.34.82,432,"Server94","Hear environmental amount remember important land.",2021-05-12T23:48:51.068833,srv-78.black.info,Bangladesh,Houseburgh,whom,Accenture
183.73.64.76,504,"Server71","Responsibility stop tonight ok room.",2023-07-31T13:39:08.848859,desktop-26.munoz-james.com,United Kingdom,Port Rachel,attention,Amazon
30.143.183.34,419,"Server57","Result crime anyone feeling.",2020-12-23T15:49:37.410418,web-01.harris.com,India,Sparksborough,party,Volkswagen
193.62.193.24,421,"Server46","Family member easy available listen network.",2024-10-01T08:10:18.562315,laptop-44.walter.com,South Korea,Tammyburgh,teach,Cisco
6.48.20.154,275,"Server62","What success culture.",2020-10-09T21:51:37.338886,srv-54.larson-horton.com,Indonesia,New Stephanie,work,Siemens
161.164.207.83,461,"Server88","Another maintain exactly art administration at range.",2020-09-02T09:44:35.305201,srv-68.shepherd.com,Russia,Baileyfurt,grow,Sony
215.23.202.119,434,"Server11","Lead accept writer try provide consumer look.",2022-12-07T20:37:12.443253,db-91.jones-russo.biz,United Kingdom,Port Kelly,upon,Toyota
72.206.94.116,598,"Server31","Thank head on million see receive officer every.",2022-06-27T04:41:13.790805,email-60.jackson.com,India,South Kellishire,serious,Apple
35.74.201.158,228,"Server46","Street easy film.",2022-10-07T11:17:34.360994,web-52.nguyen-roberts.com,United Arab Emirates,Jamesmouth,participant,Apple
63.36.18.162,595,"Server81","Defense six indeed act stay laugh.",2022-03-10T17:53:41.705879,web-27.bennett.info,Japan,Port Travis,economy,Intel
104.183.0.119,593,"Server65","Purpose low store challenge exist of.",2020-08-11T03:00:00.897708,db-73.patton.net,Nigeria,Brownton,know,Amazon
111.3.22.31,317,"Server36","Everything small audience board state morning.",2024-02-18T17:46:52.574789,web-52.gregory.net,United Arab Emirates,Moniquetown,which,KPMG
65.149.139.241,313,"Server65","Shake choose land safe stay particularly friend.",2024-04-02T19:53:37.611533,lt-48.meadows.info,Italy,West Dominiqueburgh,nice,BMW
77.77.194.89,566,"Server15","Table special result.",2020-03-29T22:52:46.591542,email-93.hunter.com,Japan,Jessicaberg,director,KPMG
