IP,Port,Device,Banner,Timestamp,Hostnames,Country,City,Operating System,Organization
55.192.5.103,417,"Server100","Your force case increase relate.",2023-08-13T21:19:55.729441,desktop-27.evans.com,Canada,Rushberg,save,BMW
108.166.201.227,257,"Server37","Hand degree reality science.",2021-08-23T23:36:27.111971,web-71.young.info,Russia,Amberborough,decade,Google
177.147.130.44,453,"Server80","Forget cause quite floor assume total huge window.",2022-02-26T15:12:37.616216,web-59.walker.net,Bangladesh,Port Ashley,page,General Electric
150.126.67.254,480,"Server29","During analysis during reflect home decision six.",2020-04-12T17:45:54.752668,desktop-25.jimenez.com,Chile,Millerborough,since,BMW
156.33.130.137,238,"Server6","Where individual plan believe.",2022-08-02T02:27:15.419478,web-84.howell-suarez.com,Pakistan,East David,hope,PwC
108.14.119.68,577,"Server27","Difference character blue environmental hand for attack.",2023-04-22T17:07:02.878453,lt-54.rhodes.com,Bangladesh,Lucasmouth,new,Tesla
168.153.121.3,419,"Server18","Thus hard film back man place.",2021-12-21T15:03:15.499607,srv-42.may-lowe.biz,Saudi Arabia,Lake Lori,eat,Samsung
192.191.3.19,592,"Server41","Pressure idea red stuff career suffer city.",2022-08-31T22:51:14.772436,laptop-86.rush-santos.com,Kenya,Heatherbury,reach,Siemens
192.9.105.208,589,"Server28","Face white on record popular change.",2022-07-08T04:43:43.419166,srv-97.nelson.info,Russia,Port Kristen,term,Apple
80.15.96.9,584,"Server40","Begin TV indicate if against think.",2023-10-03T21:32:53.203830,db-43.bell.biz,Japan,Danieltown,expect,Cisco
9.72.59.0,231,"Server73","Beyond ok explain happy nearly loss spend there.",2022-01-21T04:01:32.023185,lt-27.griffin-jacobs.info,South Africa,Jackiefort,work,Amazon
167.23.86.200,583,"Server2","Media company no word energy.",2023-06-15T21:46:14.225895,laptop-12.richard.com,Argentina,Cynthiastad,out,Morgan Stanley
99.67.205.99,225,"Server6","Whole no market general all.",2021-06-17T00:47:23.013069,web-21.espinoza.org,Saudi Arabia,East Robertatown,medical,PwC
117.170.248.107,280,"Server36","Find score miss trip anything.",2022-04-26T01:13:54.973512,srv-75.taylor.com,Indonesia,Amberstad,off,BMW
157.23.103.144,497,"Server24","Mouth week act everybody.",2022-03-06T13:01:50.101127,srv-97.brown-gilbert.com,United Kingdom,East Benjamintown,own,Goldman Sachs
183.77.69.158,218,"Server82","Politics network management thousand tree.",2021-07-26T07:36:10.280654,laptop-49.tran.com,Thailand,West Samanthaton,station,Morgan Stanley
104.228.182.51,247,"Server66","Cause dog find nothing front some theory.",2024-10-08T19:45:33.381404,email-29.smith.com,Canada,Port Jodi,anything,Sony
78.32.198.14,367,"Server41","Success everyone forward then character later drive.",2020-08-22T18:56:00.060088,lt-95.rogers.info,United States,Port Hannahville,himself,General Electric
139.186.170.145,315,"Server50","Set east deep building.",2020-12-05T05:03:04.367816,laptop-17.wilson-ferrell.info,Australia,Wheelerton,goal,Google
180.253.213.137,487,"Server45","Develop leader size source military window recognize course.",2024-05-20T21:38:37.508351,srv-47.james-gutierrez.org,South Africa,South Timothy,time,Deloitte
30.21.31.115,345,"Server15","Executive much human hundred check approach.",2023-08-07T03:32:14.534827,desktop-78.kelley-robertson.org,Vietnam,Austinfurt,reason,Amazon
58.35.54.121,442,"Server13","Especially rule statement quality room later it.",2021-07-23T10:21:39.899052,desktop-54.nguyen.info,Nigeria,East Ashleychester,protect,Ernst & Young
152.196.12.92,523,"Server22","Compare religious about fight news million.",2024-03-03T14:27:27.802981,laptop-67.phillips.com,Australia,Poolemouth,require,Volkswagen
93.203.198.102,562,"Server37","Hot magazine just order discussion structure.",2021-12-07T20:22:52.650277,desktop-29.marsh.com,Spain,South Jessica,yes,Cisco
94.242.231.171,393,"Server72","Among ten Mr information challenge.",2023-02-15T20:42:06.286620,lt-49.martin.org,Germany,Millerfurt,line,BMW
164.137.32.228,358,"Server93","Available effect himself military.",2020-05-14T03:55:40.074721,desktop-32.bell-gillespie.com,South Korea,Matthewsborough,answer,Volkswagen
209.252.174.186,304,"Server24","Five decide difficult pattern.",2022-12-29T03:31:50.185375,laptop-91.adams.com,Vietnam,East Yvette,deep,Samsung
190.179.40.195,495,"Server7","For marriage wall.",2020-05-05T16:15:18.204963,lt-51.robbins.net,Argentina,Tylerton,player,Siemens
219.242.100.173,467,"Server67","Responsibility instead represent every term why evidence.",2020-04-02T19:42:23.118533,lt-67.evans.com,India,Lake Davidbury,compare,Huawei
121.53.155.103,569,"Server98","Just deep energy provide cultural dark character.",2022-07-11T03:53:00.410003,email-19.richardson.info,Pakistan,Josephport,down,Siemens
136.4.50.3,334,"Server84","Future style effect sometimes.",2023-08-17T00:28:03.989631,email-99.mcpherson-stevens.info,Indonesia,Melissabury,model,Apple
185.180.210.168,419,"Server88","Success always another table others ability.",2023-06-15T16:57:55.029223,laptop-59.guzman-brooks.info,United Arab Emirates,Warrenhaven,become,IBM
174.62.94.52,327,"Server79","Together woman rate event.",2021-03-14T12:05:38.512536,web-04.davis.net,United Arab Emirates,Donaldton,method,Facebook
172.62.38.113,559,"Server77","Score hospital worker others.",2021-05-23T07:56:52.837419,db-05.brandt.org,Brazil,West Joseph,tough,JPMorgan Chase
58.236.26.75,357,"Server50","Tonight until interest audience.",2020-03-19T10:11:00.783181,laptop-09.davis.info,Japan,Farrellfurt,else,Toyota
218.243.29.170,504,"Server94","Lead where that type church news.",2022-03-24T23:22:32.277881,desktop-36.ramsey.com,United States,West Bradley,conference,Tesla
2.187.177.206,221,"Server49","Brother why will end star good open.",2022-09-03T13:07:28.013578,web-16.clark.com,Indonesia,East Brittany,inside,Volkswagen
92.221.40.129,334,"Server54","Help leader once collection.",2021-10-26T17:30:08.396092,desktop-06.gonzalez-serrano.net,Egypt,Johnhaven,stand,Ernst & Young
33.0.71.1,485,"Server43","Political growth choose conference knowledge.",2022-01-08T10:24:14.544090,db-84.thompson.biz,Egypt,Reyesfort,service,Sony
155.13.182.44,551,"Server79","Pretty guess blue certain thus approach.",2021-12-30T03:24:14.061729,srv-98.johnson.com,Saudi Arabia,Reidtown,safe,Deloitte
220.42.172.78,209,"Server15","Move think do son south land bit.",2023-05-04T11:24:59.851079,web-62.watkins.com,Chile,Susanmouth,talk,Intel
187.232.56.158,286,"Server29","Year effect truth chance old bag old.",2023-08-20T20:03:34.644517,db-69.gillespie-webster.com,Brazil,North Jodyport,trade,Citigroup
27.69.82.214,519,"Server21","Current offer big red box.",2021-03-02T20:53:25.674708,lt-26.berry.com,Chile,South Ronaldberg,lose,Ernst & Young
62.110.124.195,252,"Server56","To source a up relate our body.",2021-08-17T14:55:55.692316,web-45.bass.com,South Korea,Newtonchester,work,Goldman Sachs
84.218.211.193,321,"Server54","Rule which second loss across focus.",2020-01-25T16:38:24.003570,email-03.rice.biz,India,Port Dawntown,enjoy,Accenture
183.27.56.152,458,"Server76","Cut environment minute.",2024-02-10T23:23:36.368308,web-20.garcia-rios.com,France,Perryland,wife,Toyota
171.19.232.84,285,"Server30","Off this task life nation.",2023-12-22T12:08:17.284008,laptop-71.larson.com,China,New Alexis,line,Sony
130.57.151.64,282,"Server4","Space heavy one safe claim.",2021-10-06T13:47:56.367374,desktop-45.schroeder.com,Brazil,New Lesliestad,attention,Sony
212.181.84.151,213,"Server52","Rule so chair be.",2021-05-16T18:13:17.251595,laptop-79.bennett.com,Vietnam,Kylehaven,beyond,Volkswagen
153.230.28.75,364,"Server41","Word ok through east want.",2020-10-06T04:26:41.966336,db-89.campbell-pierce.info,South Africa,Ruizton,though,General Electric
89.255.135.92,537,"Server64","Trial your ahead family future drug agree civil.",2020-02-05T11:49:33.685841,web-85.harmon-stewart.com,South Africa,Lindaside,none,Amazon
20.188.195.230,220,"Server59","Support method hot bed sense cover church always.",2023-11-10T09:26:09.293438,laptop-11.luna-wolf.biz,Kenya,Browntown,instead,Toyota
89.43.218.80,394,"Server69","Behind under yes among more meet person.",2023-10-17T04:37:22.265484,srv-29.livingston.net,South Africa,Lake Alex,human,Deloitte
181.243.37.6,221,"Server41","Moment across government action house trial.",2024-08-07T05:43:06.156145,web-54.whitehead-alexander.com,United Kingdom,North Melissachester,often,Deloitte
65.19.56.205,556,"Server89","Throughout Republican catch officer attorney.",2023-03-03T07:08:06.433201,lt-27.richard.biz,United Arab Emirates,New Kevinberg,cultural,Siemens
19.155.212.107,368,"Server39","Wife allow resource wrong.",2021-07-09T21:26:36.333623,desktop-13.harris.org,Bangladesh,Port Samantha,citizen,Barclays
163.21.53.158,511,"Server13","Worry significant once knowledge future usually actually according.",2024-04-27T15:26:41.672176,lt-59.perez-johnson.info,Brazil,Hunterbury,song,Accenture
115.187.251.122,557,"Server80","Memory this end baby consider claim me.",2021-09-30T12:15:58.794707,lt-63.williams.com,Germany,Troytown,financial,KPMG
28.4.98.217,533,"Server33","Particularly poor group identify.",2021-06-09T05:00:23.370907,db-62.perez-peterson.info,China,East Hailey,speak,Amazon
86.119.109.192,517,"Server26","Piece seat natural official place degree political.",2024-08-23T15:53:17.560822,laptop-44.jones-pearson.com,Turkey,Port Jason,address,IBM
54.11.115.18,569,"Server6","Watch serve determine campaign everyone.",2022-02-11T08:27:06.607239,laptop-09.chavez.info,China,East James,leg,Citigroup
107.22.121.176,534,"Server52","Trip soon specific any idea.",2021-04-02T07:49:05.301389,db-10.thomas.info,South Korea,Lake Valerie,each,HSBC
165.48.73.29,267,"Server14","Strategy situation relate.",2020-08-09T00:37:28.977283,web-28.rivera.com,Vietnam,North Johnfort,word,Apple
94.212.178.173,310,"Server87","Week crime floor bit now a nothing.",2022-08-29T15:20:25.723874,db-42.freeman.com,Chile,East Taylor,keep,Huawei
93.250.184.218,565,"Server24","Now third image surface conference.",2022-07-01T03:54:43.198142,db-10.jones.org,Italy,Smithfort,back,Accenture
13.35.56.188,235,"Server35","Perform perform hundred may though.",2022-02-19T01:39:36.925468,laptop-97.dodson-spears.org,China,West Ivanfurt,seem,HSBC
103.202.254.242,540,"Server35","Bed brother Mr tree finish can.",2024-11-24T05:58:59.999918,web-24.graves.org,China,Diazmouth,detail,Toyota
166.238.97.138,260,"Server62","Spring year once simple both.",2020-01-18T21:27:46.822730,laptop-69.martinez.biz,Nigeria,Joshuaburgh,poor,Microsoft
218.233.16.73,524,"Server56","Left pay opportunity talk themselves should public.",2021-01-24T08:01:32.675766,db-85.wilson.net,Spain,New Kellyfurt,another,Amazon
122.105.35.217,224,"Server29","Black international blood use management win program.",2021-04-04T22:30:59.188895,laptop-52.curry.com,United Kingdom,Annchester,information,KPMG
173.127.4.17,572,"Server48","Century in if crime old decide.",2021-06-12T10:42:38.433662,desktop-57.arnold.com,Thailand,Johnsonland,choose,General Electric
129.167.26.201,407,"Server90","Town data listen career resource high.",2024-07-03T12:34:20.263983,web-95.bray.com,Kenya,North Kristen,ask,Ernst & Young
32.166.32.80,576,"Server49","Relate debate full open stuff rock kid region.",2020-06-21T01:23:26.364024,laptop-28.smith.info,Chile,Lake Pamelaport,discuss,Samsung
32.203.91.234,488,"Server54","Pull special show billion seat price idea.",2023-11-18T10:57:32.902262,srv-84.pierce.com,Nigeria,North Dawnland,white,Sony
17.207.177.199,440,"Server75","Have drug right top though whom box person.",2022-04-24T16:08:56.061627,db-54.chavez.com,Argentina,Lorifort,health,Huawei
92.201.171.161,463,"Server70","Form step be scientist ten daughter crime.",2024-05-20T19:42:07.240867,lt-59.buckley.com,United States,Garzaburgh,show,Facebook
78.192.241.46,596,"Server33","Live success herself factor piece risk.",2020-10-25T06:35:40.818779,db-43.sherman.com,Russia,Ortegaside,hair,Cisco
65.136.102.2,328,"Server83","Outside window several would.",2022-05-25T01:55:43.970361,desktop-09.lozano.org,Israel,Jennifermouth,feeling,Toyota
222.131.38.11,402,"Server39","Behind line defense rock take.",2022-05-16T22:36:06.434825,laptop-45.tate-reed.info,Italy,North Stephanie,nice,Citigroup
29.86.165.209,329,"Server15","Cover tough model relationship check.",2021-11-30T03:21:32.338079,db-70.cook-cooper.com,Argentina,Adamschester,present,Siemens
160.220.18.82,478,"Server37","Civil free conference evening range exist.",2024-01-07T22:58:34.981022,db-93.valenzuela.info,Egypt,East Wayneshire,bed,Huawei
80.55.250.233,532,"Server39","Produce yard service degree up unit.",2021-08-18T13:53:01.801326,laptop-65.young-mendez.com,Indonesia,New Shawnstad,loss,Citigroup
100.5.82.124,576,"Server19","Late operation training rise.",2023-08-16T14:13:55.026854,lt-10.ray-cameron.biz,Argentina,South Markburgh,throughout,Ernst & Young
7.45.48.217,402,"Server69","Effort stage they six Mrs.",2022-01-28T09:30:46.747512,web-20.phillips.com,Russia,New Ruthview,share,BMW
33.129.233.185,449,"Server13","Determine positive join writer strategy picture.",2021-06-02T03:35:02.782216,laptop-84.cooper-mccall.com,United Arab Emirates,Jacksontown,since,Morgan Stanley
208.2.23.200,225,"Server85","Maintain lead garden movie before deal.",2021-01-31T13:28:44.443865,srv-51.anderson.org,Egypt,Chapmanmouth,wonder,Intel
109.220.216.159,590,"Server8","Read later home early begin administration.",2024-11-24T00:21:52.405134,lt-88.campbell.com,United Arab Emirates,West Kelly,direction,Samsung
218.142.129.230,571,"Server59","Treatment our with toward four us mouth.",2020-02-29T04:51:06.479432,laptop-58.carrillo.com,South Africa,Lake Devinside,happy,Citigroup
113.187.122.127,284,"Server8","Act way wrong young successful serious Mr.",2020-09-02T06:24:14.677786,email-04.simpson.com,Italy,North Robertside,item,Ernst & Young
221.23.211.65,419,"Server68","Technology indicate right among herself.",2022-01-23T23:35:10.039982,web-94.greene.net,Spain,Port Aaron,surface,JPMorgan Chase
152.130.241.190,549,"Server42","Study event account week on many.",2024-03-02T18:54:55.838441,lt-28.vazquez.com,Mexico,Port Mandy,question,Samsung
5.73.72.93,208,"Server5","Them quality quite building military administration bar.",2022-01-17T16:06:39.152339,email-80.hull.com,Bangladesh,New Petermouth,former,Morgan Stanley
126.144.215.115,389,"Server76","Social knowledge last somebody spring itself.",2020-02-22T12:34:48.532285,laptop-34.brooks.com,Brazil,South Michelle,practice,Huawei
25.225.124.110,243,"Server88","By bill blue effect cold end.",2023-11-16T02:16:08.574912,laptop-82.levy.com,Saudi Arabia,Lake James,serve,Huawei
77.165.204.102,348,"Server100","Artist conference part environmental.",2024-01-24T15:20:40.938033,laptop-40.collins.info,Nigeria,Alanberg,character,General Electric
132.32.115.23,258,"Server61","Even likely least wind body on.",2023-06-02T11:57:15.308436,lt-72.kirk.info,Japan,Brentfurt,design,BMW
102.148.7.230,358,"Server67","Consumer never candidate despite.",2023-07-14T12:00:43.276612,laptop-19.cherry.com,Brazil,Ashleyfurt,kind,Siemens
52.167.177.66,241,"Server24","Person affect major loss watch seek face vote.",2021-05-08T02:19:38.948884,laptop-18.olsen-richardson.net,Italy,Bergton,growth,Microsoft
216.170.54.196,556,"Server49","Resource color very ability include instead trouble debate.",2020-05-01T18:32:38.240857,laptop-57.green-floyd.com,Israel,Robertbury,stand,Facebook
153.27.133.152,370,"Server41","Sea then draw fall.",2023-01-14T18:08:13.365664,email-70.hebert.org,Israel,Lake Williambury,wear,Siemens
217.81.93.149,303,"Server4","Glass budget catch tough technology.",2024-01-22T01:51:37.205643,srv-37.flores.com,United Kingdom,Jacobfurt,civil,PwC
86.128.200.252,227,"Server90","Seven class some cut over.",2023-02-15T18:15:57.178075,srv-28.johnson-strickland.com,Indonesia,Port Williamland,visit,JPMorgan Chase
198.210.182.91,302,"Server67","Sometimes address way state international civil.",2021-07-17T00:10:33.548931,desktop-04.west.biz,Turkey,Boyerland,open,Google
119.26.26.198,250,"Server59","Expert clearly nothing sign.",2023-09-05T04:10:36.816324,web-72.grant.com,China,Gilbertberg,parent,HSBC
209.16.184.167,564,"Server90","Happen price be station ball well affect.",2023-02-16T12:40:42.084539,laptop-51.johnson-hobbs.com,Mexico,North Lisa,yes,Facebook
47.29.10.38,563,"Server50","Bag set first reveal yet.",2022-11-24T22:25:15.778718,email-80.reed-henderson.com,Argentina,Port Stevenburgh,adult,Goldman Sachs
203.97.49.109,512,"Server80","Over year situation piece yet.",2021-01-31T23:10:10.914470,web-78.taylor.info,France,Millshaven,service,Oracle
128.49.10.10,507,"Server52","Sure right final worry.",2021-06-25T08:32:24.472650,email-87.gonzalez.com,Italy,Traceybury,accept,JPMorgan Chase
56.125.210.212,438,"Server32","Stand say join language begin visit.",2021-07-15T19:58:35.937920,srv-08.grant.com,Indonesia,Huffton,feeling,Microsoft
40.69.159.81,569,"Server76","Still very eat prevent different owner.",2022-08-10T02:24:15.902375,desktop-90.johnson.net,Nigeria,East Justin,mention,BMW
58.255.11.20,215,"Server64","People return anyone.",2020-01-11T18:34:14.690050,db-99.kirk.org,Nigeria,Micheleshire,we,Amazon
121.48.68.40,599,"Server44","Finally politics particularly who friend.",2021-09-05T18:07:59.485214,laptop-33.thompson-gonzalez.com,Vietnam,South Debbie,record,HSBC
112.129.204.192,482,"Server15","Bit statement cost least cover your manager.",2020-06-10T10:51:22.931030,lt-23.cole.com,United States,Rodriguezborough,guess,Samsung
46.91.103.10,363,"Server34","Model both add human.",2021-01-19T16:31:48.275954,web-44.cooper.info,Spain,Benjaminport,star,KPMG
221.4.123.83,511,"Server36","Close something which fall.",2024-06-24T02:20:05.075819,web-60.barnes.org,United States,Port Donald,about,Ernst & Young
27.122.15.130,356,"Server74","Data evidence rest film style blue almost.",2023-08-29T22:21:12.714774,srv-65.dyer-morales.biz,France,Port Angela,wall,Cisco
75.33.64.228,545,"Server96","Into red defense.",2024-02-13T12:13:10.763355,laptop-79.huff.biz,South Africa,Michaelville,protect,IBM
156.209.226.44,265,"Server20","During throughout thousand service.",2021-09-11T07:01:37.145496,laptop-01.wilson-park.com,Argentina,North Jose,or,Samsung
15.143.236.59,286,"Server12","Loss learn yard.",2021-07-31T03:31:23.493140,web-79.stuart-nielsen.net,Russia,Morristown,onto,Facebook
190.18.22.63,301,"Server71","Much bank your senior husband really plant.",2024-09-20T14:23:35.785423,web-82.cruz-bush.com,Thailand,New Justin,crime,Facebook
96.86.156.132,439,"Server17","Information involve smile spring according.",2020-02-16T19:17:05.030193,db-98.adams-brown.com,India,North Robertshire,red,Oracle
76.155.183.128,515,"Server58","Into off in whatever.",2020-08-09T17:00:54.914825,email-17.pearson.com,Germany,Lake Kaylaville,pattern,HSBC
99.79.173.80,382,"Server55","Check network million attention building.",2020-03-05T04:35:38.522500,db-02.mckinney.com,Australia,Lake Christopher,line,Ernst & Young
46.197.101.27,507,"Server59","Bed probably new former audience hospital rate.",2023-05-21T09:32:56.158344,laptop-01.james-combs.com,United States,Cheyennehaven,measure,BMW
219.42.222.120,419,"Server10","Finish human student after reason believe.",2021-01-28T23:11:50.504142,lt-94.santos.com,Pakistan,New Gregoryberg,than,BMW
75.77.246.168,220,"Server70","On also book time seat wait member artist.",2020-10-28T10:02:05.591340,email-23.ellis.com,Spain,Ericafort,throughout,Huawei
149.223.76.106,563,"Server70","Tend building treat page window while.",2021-04-13T18:03:16.740551,email-37.buckley-garcia.biz,Nigeria,Petersmouth,interview,PwC
92.146.93.248,279,"Server69","Majority whatever understand entire.",2021-06-17T04:15:49.798994,laptop-47.monroe.net,Japan,North Randy,reach,Apple
199.6.76.16,584,"Server85","Win fact nature indicate realize often sit.",2021-09-26T11:33:33.280648,web-12.kelly-long.biz,Egypt,East Dwaynestad,morning,Sony
156.194.56.230,309,"Server94","Yard along few meeting character student mean summer.",2021-11-04T09:16:09.687212,db-91.morris.net,Australia,West Troyborough,war,Amazon
214.123.184.182,551,"Server67","Center compare worker leave often court accept.",2024-02-26T10:28:01.331537,web-98.lee-aguilar.com,Australia,North Heatherfurt,nothing,Facebook
119.235.16.5,362,"Server81","Run carry sit do news above return election.",2024-02-28T12:49:46.081230,email-75.orr.org,Japan,Mendezside,spend,Goldman Sachs
92.17.186.131,471,"Server57","Become more win want organization trip himself agency.",2021-02-05T01:29:37.445577,email-06.richards.com,Pakistan,Jamesmouth,right,JPMorgan Chase
85.218.16.21,287,"Server70","Still long two now half.",2021-04-30T23:35:10.955129,db-89.davis.com,Spain,Evansshire,happen,Apple
142.52.172.255,342,"Server37","Include energy really.",2023-03-20T00:52:50.714559,email-48.delgado-hendricks.com,Mexico,South Tami,poor,PwC
53.61.31.97,287,"Server67","Television world part these manage middle part.",2024-08-10T23:09:08.176441,laptop-44.walker.com,India,West Taylor,if,Amazon
198.150.147.200,321,"Server63","Myself more truth.",2024-02-20T06:09:04.591101,desktop-91.castillo.com,Vietnam,Lopezmouth,test,Cisco
6.135.30.25,385,"Server11","Beat economy discover few number sort human.",2022-08-31T13:43:05.350160,lt-33.ayala.com,Chile,South Robertbury,once,Oracle
204.176.215.114,495,"Server77","Affect tree administration quality practice area.",2020-11-08T04:26:31.152315,web-51.smith.com,Kenya,Smithhaven,sense,KPMG
78.16.156.189,584,"Server94","Environment wall speak finish.",2024-03-21T08:11:12.323116,laptop-97.lam.com,Australia,Nguyentown,investment,Deloitte
212.255.189.18,252,"Server32","Television from society player ever.",2022-08-12T09:28:27.727159,desktop-06.hood-kim.com,Argentina,Nicoleburgh,better,Ernst & Young
52.68.26.104,589,"Server36","Weight protect simply benefit science senior.",2021-02-28T13:18:49.225754,db-66.richardson-ross.biz,Pakistan,Jimenezbury,international,KPMG
119.86.65.57,379,"Server27","Lawyer remain down later.",2022-12-07T19:57:24.366467,srv-08.lee.com,Nigeria,Morantown,method,IBM
178.185.8.168,415,"Server47","Nearly rest bill reality thus think word.",2024-01-07T07:09:53.628521,laptop-09.rice.com,Indonesia,New Aaronmouth,message,Volkswagen
76.23.115.48,283,"Server58","White win artist remain well task particularly.",2021-07-06T01:04:18.938164,laptop-52.jones.com,Nigeria,North Ronald,say,General Electric
217.173.181.212,225,"Server33","Hear manager probably even put computer job.",2021-05-02T14:51:35.983195,lt-54.gregory.biz,Pakistan,Monicafurt,and,Amazon
84.96.129.183,234,"Server21","Skin show bad next family.",2021-03-25T06:46:23.968800,desktop-71.alvarez.com,Russia,North Susan,discover,Google
28.142.123.119,408,"Server80","Entire employee drug word two difference film.",2022-03-02T13:43:47.665986,db-76.johnston.com,Italy,South Taylorburgh,protect,HSBC
21.19.23.231,319,"Server84","Trial young action audience common.",2024-09-13T16:02:11.860883,laptop-26.koch.org,South Africa,Port Debraland,knowledge,Citigroup
176.96.9.125,280,"Server78","Anyone strategy religious account likely form.",2020-06-26T22:36:06.969183,desktop-29.phillips-hall.org,Indonesia,West Samuel,few,Siemens
142.3.128.179,391,"Server61","Style here sort.",2022-09-14T19:08:35.423789,db-30.schwartz-fischer.com,Turkey,South Vickie,southern,Goldman Sachs
147.157.179.202,469,"Server45","Account strategy factor board.",2024-11-03T09:14:36.556284,db-94.reed.com,Chile,West Robertborough,sometimes,Huawei
157.243.206.227,233,"Server27","Mission fly hit.",2022-06-13T15:15:12.948962,lt-56.webb.org,Egypt,Lake Marystad,remember,Morgan Stanley
34.25.168.77,213,"Server13","Matter south beautiful.",2022-02-19T07:32:17.106905,desktop-62.contreras.info,Chile,East Hollyberg,speech,IBM
3.158.222.57,230,"Server11","Development number nice network.",2020-01-13T04:51:52.091001,laptop-94.andersen-charles.com,United Arab Emirates,Wallsburgh,fine,General Electric
133.109.184.57,348,"Server34","Late ever not order which hour less scientist.",2020-09-03T22:14:43.445962,email-35.lopez.com,Indonesia,East Hannah,sort,Mercedes-Benz
63.190.27.7,536,"Server40","Coach care figure structure recent third.",2020-08-31T06:00:13.636620,srv-91.martin-gallagher.com,Israel,Robertfurt,practice,Sony
185.85.120.48,488,"Server11","Western control us garden beat onto executive teach.",2022-08-30T18:17:11.856445,lt-67.stokes.net,France,New Lauren,floor,PwC
69.173.224.46,578,"Server61","One store party idea expert none song.",2023-04-14T08:44:30.030431,laptop-63.nguyen-conrad.net,Mexico,Rhondamouth,production,Barclays
223.197.226.18,390,"Server21","Wall senior company group provide.",2023-04-11T16:46:43.312783,srv-94.aguirre.com,Brazil,New Justinmouth,contain,Tesla
178.19.230.227,556,"Server51","Address participant growth fear police own.",2024-07-22T22:15:39.086258,web-86.hudson.com,Thailand,West Kellytown,result,Barclays
152.22.23.237,420,"Server24","Realize factor couple room investment throw western.",2023-12-09T23:27:29.884619,lt-21.smith.com,Germany,Stephanietown,would,Intel
161.3.251.17,210,"Server92","Born seem catch respond family camera future.",2024-03-27T23:31:29.944096,srv-77.butler.net,Vietnam,East Michaelberg,sister,Barclays
26.35.175.9,591,"Server82","Very scientist tell task.",2023-11-01T11:00:20.551237,srv-86.browning-gonzalez.com,Spain,West Robertburgh,pick,Google
93.81.123.163,437,"Server46","Truth new Mrs include front health.",2022-06-26T22:01:34.534936,web-58.guzman-everett.com,Vietnam,Port Colefurt,past,KPMG
45.218.215.207,354,"Server60","Up week it its rich.",2020-09-08T05:34:19.223090,email-60.hernandez.com,Thailand,Danabury,spring,Siemens
181.227.248.153,419,"Server30","Study world consider a develop around.",2023-12-24T07:40:03.272709,db-21.white-peterson.com,United Arab Emirates,Brownberg,seat,Sony
160.34.11.84,363,"Server12","Vote call under research main.",2021-12-27T15:18:57.521896,lt-42.cohen.com,South Korea,Kimberlyshire,hope,Oracle
