IP,Port,Device,Banner,Timestamp,Hostnames,Country,City,Operating System,Organization
45.190.5.119,577,"Server32","Him three long positive have.",2021-03-24T09:43:53.352026,web-48.coleman.info,China,New Matthew,reduce,Ernst & Young
148.48.131.194,360,"Server12","Must all agency force.",2020-07-22T08:14:29.559755,db-37.jordan.net,South Korea,West Dalechester,skin,BMW
18.217.171.147,481,"Server45","Half budget bring vote.",2020-09-10T13:54:40.564301,email-79.soto.biz,China,New Deniseburgh,ok,Oracle
171.215.60.75,201,"Server5","Over debate someone administration.",2020-11-11T02:51:26.983132,web-03.zamora.org,United Kingdom,Andreaside,deal,JPMorgan Chase
24.167.3.194,274,"Server42","Stuff back increase.",2024-07-04T22:22:21.943413,srv-33.hoffman.com,Spain,Rosemouth,of,Deloitte
156.234.96.119,347,"Server42","Example world ready artist word follow.",2022-09-12T04:35:33.493420,srv-06.ellis.com,Germany,North Heathertown,value,Apple
163.31.27.61,549,"Server93","Positive action tough truth several story.",2023-05-15T10:35:49.243373,srv-42.harris.com,Saudi Arabia,East Justintown,read,Intel
174.13.246.224,289,"Server58","Fight adult he table.",2022-07-30T01:03:41.866031,email-41.kent.biz,Thailand,Michelleville,pull,Huawei
12.112.78.216,452,"Server76","A call eat us.",2022-12-13T09:33:33.907338,lt-00.rivera.com,Egypt,New Justin,say,Google
73.150.52.59,354,"Server87","Concern star serve debate.",2023-06-15T11:20:08.863980,web-05.olson.com,France,Port Brendafurt,heavy,HSBC
165.3.193.71,287,"Server52","Yard option total.",2023-08-07T14:52:35.281917,laptop-16.burch.com,India,New Susan,argue,KPMG
63.200.78.159,428,"Server16","Music long away election throughout.",2020-02-09T19:46:51.545655,db-87.berry.com,Egypt,West Tracyville,firm,Facebook
93.206.164.186,341,"Server29","Hot expert investment age election machine performance hot.",2023-07-26T16:24:56.611279,email-67.morton.com,United States,Carsonfort,fast,BMW
103.92.164.9,478,"Server4","Democrat fact save measure work.",2024-01-05T22:15:20.223102,desktop-78.butler-phillips.net,Turkey,Lake Hunter,administration,Samsung
106.255.78.191,551,"Server9","White should realize thus pick.",2024-03-12T11:33:42.313452,lt-86.sexton.com,Italy,Mckayberg,successful,IBM
167.236.44.234,272,"Server84","Note grow success deal that natural keep.",2020-03-23T15:17:01.306459,db-37.walsh.com,United States,East Toddton,interview,HSBC
63.134.110.26,552,"Server77","Level film myself.",2022-08-30T14:02:23.043780,lt-20.rowe.com,Canada,Port Laura,style,Google
201.12.120.229,566,"Server66","Tend population program catch middle defense.",2023-04-02T02:47:28.654948,srv-13.anderson.com,Mexico,Port Aliciaton,impact,Microsoft
188.36.93.145,594,"Server27","Within manager professor themselves.",2021-02-04T22:45:55.638953,db-62.rivera-walsh.com,Turkey,Carpenterton,one,Accenture
69.80.8.116,439,"Server25","Then same member Republican.",2021-08-07T07:29:11.399924,srv-03.keith-grimes.biz,Vietnam,Stephaniestad,give,Citigroup
113.251.50.43,327,"Server74","Wonder plant radio lawyer detail.",2020-09-25T20:31:56.251023,db-69.snyder.com,Egypt,Mooreborough,single,Accenture
56.227.88.146,476,"Server7","Local campaign full will sure stay its.",2023-10-18T01:41:42.125404,web-80.ramos.com,Japan,Vincentfurt,media,Volkswagen
96.185.237.211,356,"Server78","Gun key bag just before their after.",2022-03-13T21:27:37.499345,lt-93.campbell.net,India,South Julie,as,Mercedes-Benz
60.51.198.180,600,"Server53","Again move protect cultural either join stock.",2023-08-25T04:54:25.760741,email-64.holmes.com,Argentina,Port Christina,hot,Siemens
39.156.173.108,540,"Server57","Most address effect sea environment late.",2023-05-07T19:13:30.342664,desktop-78.montes-brooks.com,Mexico,Lake Tyler,happen,Samsung
119.171.111.151,423,"Server34","Mind fund next during exist leader.",2021-03-06T08:34:21.799172,db-69.shields.net,Turkey,West Christina,me,Tesla
42.110.245.24,547,"Server72","Soldier mind who simply door life today figure.",2021-06-26T01:46:29.871183,db-34.kline.org,Indonesia,North Jorge,financial,Barclays
25.248.72.44,394,"Server76","Lot support near over.",2020-12-08T06:14:46.238711,lt-39.bruce-miller.org,Japan,Nguyentown,person,Microsoft
153.4.158.136,524,"Server34","Ask local forward stand dark interest.",2023-08-15T23:13:36.382076,web-82.davis-powell.info,Chile,Lake Lindahaven,behind,KPMG
157.88.163.6,325,"Server10","Enjoy community enough list.",2021-03-26T20:40:06.649251,laptop-33.ryan-nelson.org,United Kingdom,South Anne,production,JPMorgan Chase
162.133.126.173,207,"Server93","Wonder production interview shoulder.",2022-04-06T14:19:19.418099,srv-64.garcia.com,South Africa,East Yesenia,prepare,Amazon
17.21.127.65,206,"Server94","Occur item usually either hair very.",2020-09-13T08:29:15.821808,web-97.mendoza.com,Pakistan,Santosland,knowledge,General Electric
123.37.152.212,426,"Server67","Mean high son matter from card budget finish.",2021-07-08T21:34:24.467705,laptop-49.miller-wright.com,Spain,Johnsonborough,tough,Samsung
214.174.127.234,366,"Server56","Sing agree protect interesting.",2023-03-07T06:15:29.335272,srv-26.petty.com,Argentina,Andersonland,test,Mercedes-Benz
129.67.250.116,221,"Server74","Pm state PM political vote executive American.",2022-02-27T01:44:53.119013,email-77.barnes.com,Spain,North Eileenhaven,population,HSBC
76.122.86.157,476,"Server37","Husband strategy whole also hotel type hold.",2020-11-22T05:03:04.323494,db-10.velazquez.com,Egypt,Rodriguezchester,case,Google
65.188.220.221,344,"Server33","Difference money computer follow system.",2020-07-01T01:58:05.856119,web-72.powell-obrien.biz,Saudi Arabia,Foleyfurt,easy,JPMorgan Chase
185.172.244.108,538,"Server74","Fact claim least.",2020-01-14T09:25:44.143150,srv-21.douglas.com,Saudi Arabia,Mathismouth,book,JPMorgan Chase
43.108.210.57,575,"Server26","Wonder challenge ever claim.",2024-04-08T00:16:48.117284,web-88.davis.org,India,South Emilybury,own,Huawei
211.147.69.8,553,"Server63","Water reach remember.",2021-07-09T00:43:00.294528,srv-39.best-carter.com,Chile,Parkerton,simple,IBM
176.204.187.113,210,"Server34","Positive threat major whatever popular.",2024-11-02T15:38:28.109894,lt-30.gamble-gibson.info,Argentina,New Daniel,collection,Amazon
17.129.26.215,432,"Server40","Because effect name.",2021-10-13T16:35:39.483613,desktop-25.horton-stewart.com,South Korea,West Jose,position,Cisco
62.234.186.210,306,"Server75","Area else increase short camera table.",2023-08-03T20:50:10.874189,laptop-44.lambert.biz,Thailand,Deanside,responsibility,Huawei
166.26.141.182,512,"Server83","Sit somebody outside citizen successful view yes wish.",2022-09-10T19:36:21.670879,db-90.lara-malone.net,Mexico,South Valeriebury,adult,PwC
167.183.29.154,282,"Server31","When challenge point suddenly herself.",2024-06-29T01:27:40.045786,lt-74.marks-young.biz,Bangladesh,Hortonmouth,evidence,Tesla
124.36.116.148,330,"Server29","Ahead goal care raise.",2021-12-10T07:21:24.712236,desktop-15.valenzuela-collins.com,France,Jackside,inside,Volkswagen
146.239.194.122,235,"Server11","Staff continue world.",2020-10-31T23:45:50.424772,desktop-38.johnson.com,Japan,Nicolasburgh,paper,Google
212.244.240.26,227,"Server72","One available usually figure.",2020-11-13T14:40:46.731937,db-92.foster.com,Argentina,Romanhaven,focus,Cisco
163.43.37.209,545,"Server9","Peace suddenly them reveal thus.",2024-03-27T01:48:51.391147,srv-20.miller.net,Germany,East Tammyland,avoid,Accenture
184.91.136.180,568,"Server36","Letter hard oil.",2023-12-29T13:39:22.783752,srv-86.adams-hansen.com,South Africa,North Michelleland,wind,IBM
174.119.141.151,209,"Server38","Station front task young.",2024-07-03T22:12:11.031978,web-55.alexander-mitchell.com,United Arab Emirates,Edwardsfurt,during,Volkswagen
31.169.24.242,551,"Server71","Alone world theory statement.",2023-08-22T23:00:46.932665,web-30.medina.info,Vietnam,Colehaven,answer,JPMorgan Chase
85.185.138.16,599,"Server28","Money task reflect.",2021-10-30T09:02:15.338237,email-22.patterson.com,United Kingdom,Port Daniel,group,Amazon
162.54.34.103,437,"Server83","Alone save person outside.",2021-07-02T21:16:58.144592,db-11.clarke.com,Russia,East Carlafurt,author,JPMorgan Chase
94.70.151.23,553,"Server38","Night bank something really wife.",2024-08-18T07:06:30.758417,web-18.torres-nguyen.biz,Italy,Mooneyfort,national,IBM
7.56.73.166,242,"Server85","Somebody same author quickly.",2023-10-15T08:29:36.154851,db-37.le.net,Vietnam,Joelberg,clearly,Volkswagen
81.219.59.99,338,"Server20","Result notice stay act meeting standard safe.",2022-09-12T15:31:37.971497,laptop-80.williams.com,Turkey,Lake Jonathanborough,somebody,Huawei
150.82.207.215,422,"Server34","Form go never.",2023-12-07T05:16:47.809764,laptop-84.baker.com,Thailand,Ballville,share,Volkswagen
38.212.227.0,535,"Server95","Consider dinner there.",2020-10-08T19:28:06.735514,db-00.stafford.com,India,West Joseph,road,Oracle
214.214.156.234,504,"Server31","Stand seek best.",2022-11-03T22:01:01.559302,email-88.patel-jefferson.com,Nigeria,Thorntonburgh,ready,Microsoft
72.195.151.255,351,"Server82","Human per available morning.",2023-10-06T23:13:22.194245,db-98.shepard.com,Israel,Benjaminmouth,either,Volkswagen
55.120.144.104,317,"Server20","Prove attention trip decision.",2020-09-02T17:14:33.054452,laptop-72.smith.com,Thailand,South Dorothymouth,far,JPMorgan Chase
196.36.151.187,382,"Server80","Town include newspaper unit.",2022-01-29T17:40:40.058514,laptop-41.garcia-woodard.com,Italy,Josephhaven,letter,Ernst & Young
211.120.172.155,479,"Server94","Remember teach since unit we truth.",2020-10-20T09:31:04.578555,db-19.morgan.net,Indonesia,Williamville,present,Toyota
153.4.50.103,332,"Server35","First technology should focus provide almost.",2021-12-04T02:48:27.858553,laptop-43.may.com,China,Matthewsview,enter,Morgan Stanley
14.95.223.226,308,"Server82","Remain project tough will trial.",2024-12-03T14:45:00.062434,desktop-25.perez.biz,United States,South Richardberg,candidate,IBM
140.87.69.51,450,"Server31","Book cause brother forget soldier.",2022-08-21T12:52:13.620424,lt-04.nolan-price.com,Japan,Nathanmouth,enjoy,General Electric
198.232.31.136,282,"Server82","His force decision be dinner position.",2023-03-08T04:10:49.362326,laptop-35.whitney.com,Israel,Sandersburgh,challenge,Deloitte
129.239.241.97,592,"Server30","Marriage player month tonight.",2021-02-07T19:23:27.654903,web-70.brown.org,South Africa,Port Lisa,daughter,Samsung
189.164.137.137,254,"Server70","Talk ago over of law.",2021-08-24T15:05:51.521749,srv-57.sellers.com,South Korea,Port Stevenchester,cause,Citigroup
161.208.69.21,508,"Server23","Option product protect method husband executive newspaper imagine.",2020-06-08T11:35:40.309641,laptop-20.lee.com,United States,East Jacqueline,single,Toyota
191.127.128.136,435,"Server53","Commercial hospital close anything.",2021-07-31T00:17:22.525588,lt-17.montgomery.com,Italy,Burgessville,kind,Facebook
165.204.193.238,569,"Server83","Nothing might worker how set other.",2024-12-04T22:48:44.811479,lt-03.avery.net,Brazil,Ramosstad,note,Tesla
104.31.92.172,548,"Server25","Message activity amount here quite.",2020-05-20T07:26:12.419160,srv-09.johnson.com,Saudi Arabia,Erinshire,happy,Toyota
56.63.107.151,578,"Server13","Citizen back relationship.",2022-10-19T22:51:17.698775,db-76.gibson.info,Germany,Mccormickstad,south,Sony
192.135.157.216,353,"Server50","Beautiful program drop for support identify back.",2021-09-09T04:16:07.150809,srv-69.palmer.com,South Korea,Harryburgh,protect,Cisco
201.177.209.86,416,"Server37","High act very former lot itself.",2024-09-23T16:37:56.578145,desktop-44.fleming.com,Argentina,North Seanside,throughout,Ernst & Young
106.18.190.254,496,"Server45","Word everyone worry face garden up.",2023-01-19T10:50:57.345767,srv-17.hill.com,United States,Higginsland,above,Samsung
219.253.120.236,473,"Server24","Office man quality water shoulder.",2022-11-08T17:40:08.565255,db-81.gaines.com,Russia,Lake Cathyton,wide,Apple
78.142.39.43,585,"Server76","Meeting investment turn activity health important.",2022-10-17T18:03:10.082362,srv-50.ramos.biz,Russia,Shelbychester,same,Deloitte
45.86.128.76,462,"Server96","Collection sell continue year drug knowledge road degree.",2020-10-02T05:02:09.328780,laptop-65.ross.com,Kenya,East Eric,gas,Huawei
79.202.162.209,501,"Server59","Ahead vote his my past benefit.",2021-07-05T03:01:58.786143,desktop-11.cunningham-jackson.com,United Kingdom,Susanfurt,kitchen,General Electric
67.231.86.15,488,"Server64","Government school vote economic hold customer direction.",2021-05-11T15:38:10.556598,web-98.vega-shah.com,Bangladesh,Meganmouth,them,Microsoft
196.0.202.72,224,"Server71","Memory movement color cup black vote one.",2023-11-01T02:44:30.240398,srv-11.torres-mack.com,Germany,Cunninghamland,common,Siemens
118.128.33.8,460,"Server15","Trial page wide manager.",2021-09-10T05:55:42.467052,email-91.hernandez.com,Italy,West Johnmouth,leader,Google
72.234.94.184,238,"Server24","Note build environment wish.",2020-03-31T09:10:11.678383,web-36.moyer.com,Argentina,West Michaelton,second,Samsung
147.143.93.151,564,"Server80","Most relationship staff song expect similar.",2020-09-14T07:05:28.343404,email-40.mcgee.info,Mexico,Ronaldmouth,truth,Google
76.178.230.81,414,"Server84","Work feel back end rule north nation.",2023-10-23T11:55:57.619725,desktop-13.benitez-jones.net,South Africa,Torresmouth,business,KPMG
13.230.255.113,500,"Server26","All guy high certain people suddenly wrong.",2020-06-21T09:23:37.773800,lt-37.hines.org,Argentina,West Edward,power,Morgan Stanley
137.190.37.244,281,"Server78","Nation outside store science million.",2023-08-11T22:33:07.074050,srv-04.fox.com,China,Michaelfort,smile,General Electric
73.29.206.208,321,"Server61","It want begin old.",2022-10-04T20:04:27.969458,laptop-96.rodriguez.biz,Egypt,South Lisachester,beat,Volkswagen
43.192.146.41,516,"Server66","Set administration base fire likely.",2021-08-14T02:03:26.789196,web-80.crawford-spencer.org,Kenya,Chrisland,prove,Siemens
38.5.243.51,564,"Server54","Life still important general movie five husband.",2020-05-18T00:09:06.557708,srv-12.figueroa-obrien.com,Indonesia,Blackbury,quite,Microsoft
122.214.129.224,505,"Server65","Throughout very step see free.",2023-12-16T19:36:56.882662,srv-19.knight-maldonado.com,Turkey,East Patricia,economic,HSBC
146.204.134.167,262,"Server46","Answer offer continue protect.",2021-02-17T14:14:08.561142,desktop-74.hernandez.com,Saudi Arabia,North Victoriamouth,front,Barclays
81.207.247.63,547,"Server23","Shoulder fall if suggest ready develop.",2023-01-18T15:40:53.076648,lt-99.johnson-fitzpatrick.com,Mexico,Murrayfurt,way,Google
99.39.239.169,588,"Server85","Buy support several bit well resource three.",2024-03-09T16:24:52.720469,lt-84.mccoy.com,Spain,Lake Joshuaburgh,song,HSBC
95.77.169.173,399,"Server93","For central have participant such person resource.",2023-08-20T15:48:27.891636,laptop-58.gentry-hogan.com,Vietnam,Calebmouth,various,Siemens
87.148.89.132,545,"Server92","Partner year section fish.",2023-08-12T10:25:00.422640,lt-79.lopez.com,Russia,Connerport,any,Sony
140.64.156.142,361,"Server72","Off thus commercial ground determine available.",2020-08-08T09:35:10.799309,laptop-70.villanueva.com,India,Brownberg,eat,Intel
11.124.28.60,455,"Server44","With remember friend listen.",2020-07-09T09:09:41.278558,laptop-90.wolfe.com,Bangladesh,Lake Antonio,that,Citigroup
167.206.172.72,366,"Server35","Sister red citizen.",2021-10-05T12:00:45.871030,web-91.kemp.com,Saudi Arabia,Lake Emily,down,Apple
148.61.22.71,259,"Server86","Be report generation reach.",2021-08-17T00:15:12.516446,email-14.barker-coleman.info,Brazil,Tammyport,it,Oracle
25.6.103.253,386,"Server34","By least treat lay music offer why.",2021-11-06T03:46:55.692164,db-90.malone-burke.org,Japan,Jillberg,run,Huawei
188.6.189.195,374,"Server47","Range explain while apply.",2022-06-15T04:39:08.356276,lt-08.rollins-weiss.com,China,North Travis,herself,Microsoft
71.130.64.241,476,"Server20","Party pattern place late him key.",2022-12-11T05:09:45.421721,db-38.moore.com,South Korea,Port Robert,agent,BMW
111.65.1.163,382,"Server17","Research decide thousand each spring food leave.",2022-08-01T02:12:45.111233,email-09.green.com,France,Danielleside,worker,Volkswagen
129.93.201.53,462,"Server67","Discuss become get term rest others thousand.",2020-02-15T04:17:00.881760,desktop-63.whitaker-smith.info,United Arab Emirates,Jeffhaven,seven,Volkswagen
37.30.94.18,448,"Server7","Environmental fly at issue his piece.",2024-02-08T00:40:18.152515,desktop-34.randall-weeks.com,South Korea,Lake Kyleshire,cup,Google
146.119.165.7,267,"Server28","Throw art piece successful decision prepare decide dinner.",2021-05-18T03:48:34.727604,email-85.johnson.info,Russia,West Stevenfurt,clearly,Apple
46.39.14.192,509,"Server57","Establish account film she company nation same.",2022-05-19T21:04:31.038727,srv-74.lynch-davis.com,Spain,Brandymouth,thank,Accenture
137.93.68.82,535,"Server71","Wait school avoid almost.",2023-07-29T06:14:08.153694,lt-52.collins.com,Nigeria,East Lisaview,affect,Samsung
142.144.162.16,589,"Server32","Threat remain election room.",2020-01-29T00:18:13.143686,lt-34.jones.com,Germany,Gregoryton,customer,General Electric
135.255.135.123,305,"Server52","While push phone somebody interest bag radio.",2023-03-25T01:07:58.608575,srv-33.mcintyre.com,South Korea,Lake Williamville,young,JPMorgan Chase
133.85.11.247,403,"Server51","Perform major after call.",2020-12-13T02:38:30.923682,laptop-85.gonzalez.com,Brazil,North Markburgh,car,Tesla
174.104.95.71,570,"Server50","Onto expect know pay different bring real.",2021-03-14T06:20:50.325456,desktop-82.simpson.com,United Kingdom,New Ashleystad,drive,Tesla
61.60.136.21,232,"Server7","Billion area even history turn protect wait.",2024-04-07T20:05:56.066640,db-12.perry.com,Egypt,South David,out,Huawei
147.52.142.105,246,"Server19","Determine most young free identify.",2021-09-06T02:11:41.249847,laptop-88.campbell-young.com,Brazil,Woodston,religious,Goldman Sachs
69.39.13.26,418,"Server74","Hope must free various situation mention.",2022-01-02T04:00:11.032428,srv-25.williams-henderson.com,China,Lake Karamouth,far,Google
142.93.15.51,244,"Server9","Less image scene source success figure recent.",2022-07-27T16:47:20.092103,lt-32.cobb.com,Nigeria,Sierrastad,rich,BMW
84.241.61.42,220,"Server74","Stock water himself detail far admit.",2022-06-01T22:51:44.407763,laptop-61.whitaker.com,Italy,Lindsayland,fill,KPMG
60.54.88.110,452,"Server82","Possible one brother.",2022-07-09T10:19:19.775017,lt-58.skinner.com,Indonesia,Prattside,pick,IBM
218.20.81.243,407,"Server4","Than candidate style modern.",2022-12-29T11:17:31.651538,web-94.butler.com,Argentina,North Kimberly,debate,Sony
120.88.107.130,372,"Server61","Message sound bad put rate general.",2021-10-25T23:30:36.382762,web-95.patterson-richardson.biz,Argentina,Port Kayla,arrive,Sony
216.233.67.76,328,"Server2","Yes myself look score buy sense necessary.",2022-02-26T06:07:14.720270,web-25.durham.com,Saudi Arabia,Port Amy,better,Huawei
166.242.39.130,476,"Server66","Often certainly decade third.",2023-03-15T07:56:14.504197,laptop-44.alvarez.net,Bangladesh,New Jillmouth,remain,Accenture
205.189.80.227,401,"Server87","Out ball almost yourself situation them street.",2021-12-30T00:55:22.891535,srv-34.esparza.com,Saudi Arabia,Crystalbury,guess,Siemens
178.225.93.56,415,"Server42","List never firm unit sense.",2024-07-31T21:00:27.546726,lt-34.boyle.org,Nigeria,Robertland,tax,Sony
159.194.206.254,369,"Server94","Several week rate yeah later.",2021-12-28T03:26:05.067695,srv-35.davis-thornton.com,Pakistan,Andrewhaven,raise,Intel
65.209.228.70,276,"Server63","Over vote five film.",2023-11-30T02:49:58.102880,srv-49.stevens.com,Israel,Amandabury,catch,General Electric
156.187.31.127,276,"Server3","Billion term although stock.",2023-08-11T16:38:25.397628,srv-97.clark-perez.com,Kenya,Andersenport,car,IBM
200.160.21.11,552,"Server44","Line hard stuff rate bank charge develop.",2024-04-20T11:06:30.670152,laptop-45.walter.com,Japan,Brenttown,audience,Ernst & Young
75.221.155.127,476,"Server71","Article where day.",2020-03-18T08:05:43.543855,lt-32.yates.biz,China,Camposmouth,small,Huawei
148.136.165.49,402,"Server15","No affect buy question condition look.",2022-03-22T00:33:29.145850,db-41.russo-lawson.com,Bangladesh,Ricardoland,party,BMW
84.73.142.227,461,"Server29","Board tough want case two building.",2021-07-02T09:45:49.853906,email-83.boyle.com,Vietnam,Amberfort,find,Toyota
65.74.197.94,509,"Server39","Increase feel tough quickly firm think them.",2020-05-19T12:15:47.220832,email-88.kelly.info,Argentina,New Haleyborough,guess,Intel
30.189.53.12,417,"Server90","School particular old great network.",2022-04-01T23:37:46.345475,srv-62.kent.com,United States,Michaelhaven,never,JPMorgan Chase
214.144.169.196,287,"Server47","Stock affect suffer relationship same.",2022-03-18T17:13:33.377096,desktop-43.shepherd.com,Argentina,East Alexander,military,KPMG
150.118.149.187,415,"Server87","Notice difference suggest glass.",2021-12-16T08:52:35.448001,web-82.williams.net,Vietnam,Port Williamtown,two,Barclays
28.109.72.207,305,"Server100","Particularly collection else condition.",2023-07-28T15:36:23.856194,desktop-79.jones-black.biz,South Africa,Connerville,break,Volkswagen
42.159.66.242,366,"Server61","Forward war about take run relate.",2024-01-15T16:16:56.270819,srv-11.navarro.net,Mexico,Lisabury,public,Goldman Sachs
120.190.186.173,384,"Server78","Ready successful relationship whatever child radio.",2024-08-29T03:18:18.142303,web-64.woodward.com,Russia,New Jeanport,nearly,Mercedes-Benz
25.170.32.209,217,"Server77","Age month audience campaign after picture.",2020-01-27T08:03:02.208328,web-68.scott.com,United Arab Emirates,Elizabethburgh,friend,Amazon
138.247.31.215,286,"Server56","Send even sense add threat fact never.",2020-08-06T05:50:15.516428,lt-46.nelson-hall.com,Bangladesh,Williamsmouth,throw,Oracle
134.114.205.70,297,"Server53","Describe series role car person.",2021-10-24T06:04:46.449743,email-01.ball-evans.com,Egypt,North Anna,color,Cisco
73.101.154.221,322,"Server63","Girl both attack.",2022-12-19T05:17:41.706268,srv-74.white.com,Japan,East Brittanyport,form,Huawei
177.181.178.199,436,"Server28","Make wait ask beautiful health.",2020-08-03T22:23:19.654022,laptop-87.ortiz-rogers.net,India,Port Sharonfurt,surface,Accenture
173.55.204.226,359,"Server97","Role pull wrong above memory yet quality.",2024-01-05T10:35:07.648138,srv-46.baker.com,India,West Lucasbury,better,Citigroup
200.92.219.5,423,"Server50","Student prepare rich skill.",2023-05-18T22:37:34.378859,desktop-76.brown.com,Brazil,East Douglasberg,field,Sony
148.29.107.166,508,"Server85","Often practice foreign such laugh pattern.",2024-04-28T11:37:22.493876,srv-72.mueller.biz,Israel,Jeffreyhaven,what,JPMorgan Chase
163.205.252.101,584,"Server46","Trial star understand after line through religious.",2022-06-08T23:26:22.156013,srv-33.dunlap-calhoun.biz,Brazil,West James,behind,Barclays
32.122.196.243,466,"Server33","Painting mother suddenly this.",2021-12-03T12:29:56.915602,desktop-63.odom-garcia.com,Egypt,Lake Davidchester,current,BMW
41.205.143.233,455,"Server82","Almost process goal growth interview add.",2020-05-04T04:09:42.542798,email-82.rivers.org,Kenya,Terriville,most,Deloitte
215.83.49.169,221,"Server2","Age detail three drug heavy.",2022-02-09T22:39:37.487496,laptop-06.dunn.net,Russia,Swansonchester,south,Morgan Stanley
32.179.20.118,419,"Server28","When you season improve now its.",2022-11-19T01:58:32.696850,desktop-55.roberts.com,Turkey,New Michaelville,road,Samsung
171.4.160.50,493,"Server59","Result agree drive away player world.",2024-04-16T15:02:32.731641,srv-64.copeland.com,United Arab Emirates,Debbietown,toward,Oracle
194.122.22.77,569,"Server64","News common begin grow model social tonight.",2020-11-17T07:26:35.090282,laptop-27.jones.org,Pakistan,Port Joshuaview,space,Toyota
194.79.204.140,401,"Server10","Us visit best per book cold.",2024-11-21T16:59:09.502783,laptop-17.moody.com,Japan,New Denisetown,glass,Deloitte
47.172.251.244,407,"Server91","Letter tend ability.",2022-03-31T19:11:38.148657,db-19.dawson.com,Australia,Wilkinsonhaven,yard,Intel
202.102.146.12,549,"Server49","Successful practice get day.",2022-03-17T12:28:41.535290,laptop-86.henry-johnston.com,Russia,Susanchester,physical,Huawei
201.74.234.115,534,"Server62","Trade record trip far play road.",2021-11-30T21:48:26.421616,desktop-21.hicks.biz,Thailand,Port Christopherburgh,the,Goldman Sachs
154.172.61.245,306,"Server18","National soon anything.",2022-10-11T02:26:46.279490,desktop-76.larson.com,Israel,Chaneyfort,yard,Sony
210.212.160.182,502,"Server24","You increase decide partner.",2022-06-29T19:19:41.138513,srv-28.cohen.net,Indonesia,East Gregory,let,Barclays
92.56.206.153,349,"Server91","Their money majority step.",2024-04-29T02:54:17.200056,laptop-10.hernandez.biz,South Africa,East Seanberg,study,Sony
64.120.235.16,396,"Server91","Tough education day.",2024-04-02T22:40:38.924274,srv-81.mcclain.net,France,Port Garybury,too,Barclays
205.71.193.13,318,"Server56","Whatever require fill beautiful.",2024-08-14T20:52:38.372879,laptop-85.webster.com,United Kingdom,New Gregoryton,say,Siemens
164.226.204.119,363,"Server1","Site usually ever sit turn toward.",2021-01-13T18:48:19.078069,laptop-67.mullen-thomas.biz,Israel,Maryberg,agree,Microsoft
172.211.97.233,428,"Server29","Teach near road single because chair police.",2022-04-30T08:00:10.505796,email-74.jimenez.biz,Thailand,Lake Nicholas,water,Apple
198.241.92.141,415,"Server20","Technology agent base firm side skin real.",2023-11-26T13:47:34.412373,srv-88.mcdaniel-kim.biz,Canada,South Luis,statement,Accenture
204.124.183.55,238,"Server66","General wife society plan science.",2023-12-13T05:07:27.949782,db-20.blackwell.com,Indonesia,East Christopher,physical,General Electric
