IP,Port,Device,Banner,Timestamp,Hostnames,Country,City,Operating System,Organization
62.247.56.108,323,"Server29","Stage after near away campaign factor.",2024-09-29T21:33:19.822803,email-57.phillips-pacheco.com,Chile,West Bradton,certain,Google
159.237.98.226,343,"Server85","Include face both many what father.",2022-04-23T17:17:15.301387,laptop-62.holt.com,Germany,Timothyshire,bank,Sony
106.219.43.41,577,"Server41","Feel bring individual national us case beyond.",2022-12-29T11:29:23.062278,db-53.stephens.com,Bangladesh,Brownshire,sport,BMW
41.88.179.184,345,"Server63","Home music member after prepare.",2020-02-29T18:30:12.352277,lt-37.gray.com,Argentina,Lake Johnnyville,common,IBM
123.27.168.220,202,"Server36","Professional street this some only federal.",2023-07-13T22:17:59.229136,srv-04.douglas.com,United Arab Emirates,Andersonchester,girl,BMW
50.153.24.244,393,"Server7","Those open ask mission among.",2021-03-29T19:13:53.804589,email-27.carroll.net,Germany,Campbellmouth,arm,JPMorgan Chase
126.72.235.18,425,"Server39","Nice may remember interest feeling.",2021-02-10T10:51:53.287964,lt-09.boone-parks.biz,Kenya,West Christian,notice,Volkswagen
147.99.242.55,200,"Server77","Television unit effort sense.",2024-04-06T03:11:53.350720,desktop-28.baker.com,Indonesia,East Erinville,success,Cisco
185.214.183.126,425,"Server8","Significant exist ago western leg pressure like wait.",2021-04-10T17:21:30.696257,laptop-60.johnson.biz,Vietnam,Jasonmouth,focus,Citigroup
135.194.48.39,381,"Server68","Authority billion public back.",2020-04-16T20:56:41.849784,desktop-65.lynch.com,South Africa,Escobarfort,interesting,General Electric
103.109.164.192,495,"Server25","Trouble mind song organization senior couple toward upon.",2021-04-09T07:41:08.035236,email-29.jordan.com,Canada,Port Laurenmouth,early,Morgan Stanley
109.83.147.196,371,"Server50","Decision woman owner.",2021-12-12T18:27:33.168694,lt-76.black-coleman.biz,Russia,North Timothyport,something,General Electric
133.68.39.224,556,"Server41","Where walk never many write star fine.",2023-12-15T03:50:57.892458,srv-69.ayala.org,Canada,West Lisa,interview,Microsoft
40.117.75.29,563,"Server53","Build fall office writer born.",2020-10-17T14:17:49.044498,desktop-40.silva.com,Thailand,South George,gun,HSBC
113.72.204.145,522,"Server96","Question treatment in statement like.",2022-05-18T20:56:01.354673,laptop-50.long.com,Kenya,Mccallside,somebody,Morgan Stanley
60.172.29.142,412,"Server25","Paper least once note again standard from.",2021-11-04T01:12:34.933102,desktop-90.petty.org,Spain,Ruizside,him,Accenture
145.0.15.124,518,"Server63","Wait decision market common.",2024-11-28T16:08:02.366796,desktop-11.cook.net,Spain,Alfredfurt,result,JPMorgan Chase
83.23.122.31,589,"Server36","Figure shake near.",2021-01-09T10:16:27.873901,db-62.lee-edwards.org,United States,Lewisland,last,Siemens
62.39.177.167,214,"Server52","Information beyond your election.",2022-12-24T11:11:45.675125,email-79.hayes-mitchell.com,Kenya,New Christopherport,medical,Mercedes-Benz
141.29.122.232,343,"Server47","Old draw fact nation place.",2020-10-10T03:18:04.328752,lt-41.wilson.com,Bangladesh,South Keith,I,Facebook
31.158.34.160,483,"Server100","Leader building around board administration nor.",2023-06-23T13:50:35.304000,web-49.jordan.com,Mexico,Marychester,school,Amazon
42.110.175.206,309,"Server22","Final spring only house may fear give.",2024-11-01T15:40:55.561868,web-66.fuller.net,United Kingdom,Johnstonchester,speech,PwC
154.135.79.223,580,"Server44","Manager spring Mrs west everything.",2021-05-24T07:37:40.974121,email-93.daniel.biz,Thailand,Hickmanport,good,JPMorgan Chase
210.51.49.247,574,"Server57","All strong bring box test social raise whom.",2023-06-06T14:27:52.474360,db-42.keith.info,China,East Matthewland,nothing,Google
167.81.230.58,480,"Server2","Official necessary wish true big site out.",2024-07-14T05:56:19.495584,desktop-86.thompson.biz,Argentina,Thorntonland,talk,Mercedes-Benz
45.92.58.148,508,"Server93","Sport stage month image.",2024-12-12T04:32:18.326900,lt-92.holder.biz,Russia,Port Samanthaport,management,IBM
45.133.135.104,403,"Server9","Not allow star determine we follow.",2024-07-27T08:52:54.878614,db-78.garcia-sullivan.com,Chile,Matthewston,particular,Accenture
86.107.39.218,487,"Server44","Answer evening program cut vote.",2023-08-15T01:26:15.470074,web-20.davis.com,Turkey,Lake Nancy,film,Microsoft
122.47.163.59,262,"Server42","Charge write bed question.",2024-02-21T01:12:44.873184,srv-15.pittman.net,Australia,Hartville,either,JPMorgan Chase
60.96.22.51,422,"Server53","Carry other example well particular laugh difficult.",2022-05-30T10:12:19.915019,lt-71.montoya.com,Kenya,Carrieton,must,BMW
136.161.113.38,524,"Server40","Interview would daughter seven.",2021-03-02T04:15:59.876441,srv-40.pineda-browning.com,France,Joelburgh,fund,Deloitte
118.218.2.40,561,"Server71","Cold trade town real.",2020-03-11T14:56:52.289550,email-78.bullock.com,Kenya,Cookview,white,Intel
27.61.144.159,232,"Server73","National worker on born.",2021-09-16T05:33:57.002334,db-22.mcdaniel.info,China,Erikafort,second,KPMG
132.3.108.91,562,"Server12","Who involve money owner exactly.",2024-04-13T20:24:24.701506,db-55.jackson.com,United Kingdom,Markland,television,General Electric
136.128.73.162,343,"Server69","Health risk size improve.",2021-08-17T06:43:50.140367,laptop-86.avery-scott.net,Spain,Jenniferstad,every,Goldman Sachs
118.241.153.137,507,"Server76","International watch explain science.",2024-12-04T11:11:24.629445,lt-26.wolfe.info,Spain,East Carol,push,Google
204.83.139.37,591,"Server72","Project dinner test remember while.",2021-05-29T09:28:45.989903,web-62.grimes.biz,South Korea,Tylerchester,look,Morgan Stanley
194.230.31.33,229,"Server1","Sort speak later share.",2023-07-25T02:03:03.430593,laptop-71.roth.com,Israel,Brownburgh,lose,Apple
26.30.230.218,314,"Server40","Account stuff station service hope.",2021-01-29T16:22:44.291555,web-55.butler-carson.com,Kenya,Nicolemouth,or,Volkswagen
179.130.55.140,531,"Server59","Various agency result late born become work.",2020-05-06T20:18:18.945451,lt-73.perez-cook.org,South Korea,Lake Tonyashire,just,Toyota
200.151.224.193,480,"Server13","Factor arrive present traditional short within.",2021-03-05T07:47:43.504003,laptop-75.gutierrez-shaw.com,Chile,Mckeeberg,new,Cisco
222.144.122.239,376,"Server55","Rate later brother away star prepare event may.",2022-07-11T02:20:09.495654,web-94.james-ruiz.com,Russia,South Kathleenchester,situation,Mercedes-Benz
215.12.179.129,458,"Server7","Top contain night mean board range into number.",2020-04-06T16:07:18.762691,desktop-90.sanders.com,China,East Amyfort,anyone,Citigroup
211.15.40.205,228,"Server60","Series campaign remain less positive.",2023-05-30T17:24:20.902537,email-49.williams-mullen.com,Israel,Joelmouth,central,Barclays
112.113.136.198,401,"Server72","Already ten owner hold name new.",2020-04-09T11:06:59.998134,laptop-39.hudson-porter.com,Chile,East Tinaborough,population,Apple
44.26.56.217,485,"Server86","Wonder visit claim people though commercial.",2021-03-20T07:47:50.574930,db-69.smith.com,Argentina,Juanshire,authority,IBM
220.21.150.140,277,"Server72","Control player just sing inside yeah economy.",2020-05-29T03:14:00.635843,web-73.mcconnell-nelson.com,United States,Luisfurt,support,Deloitte
51.93.168.143,582,"Server62","Trip leg most first.",2024-05-21T00:12:54.103763,email-78.young.com,Australia,East Kristinton,then,PwC
27.38.127.111,423,"Server17","Require shake TV executive scientist current.",2020-07-04T21:55:05.919349,srv-58.small.org,Thailand,Petersenshire,whose,Intel
156.96.163.198,250,"Server12","Range could everyone.",2021-03-26T04:58:34.559483,web-70.lawson.net,Brazil,North Ryanview,base,Google
207.73.45.49,294,"Server35","Stand maybe perform manager bring.",2022-05-02T00:33:53.670829,desktop-79.brown-hunt.com,Australia,Kimberg,model,Amazon
220.120.48.253,532,"Server65","Ever film by best.",2022-07-15T06:45:23.556461,lt-94.kent.com,Egypt,West Arthurmouth,sport,BMW
160.101.179.139,510,"Server37","Question have activity capital everyone door.",2024-03-30T20:55:05.109677,srv-89.smith.net,Vietnam,South Katherineview,protect,Citigroup
67.6.196.162,418,"Server74","Amount half must.",2021-04-09T01:08:07.565108,srv-54.santos-rodriguez.net,Vietnam,Teresastad,beautiful,Siemens
48.46.206.167,420,"Server100","Likely especially class available response join account.",2023-04-28T14:28:39.783441,web-30.villa.net,Egypt,Wilcoxstad,case,JPMorgan Chase
193.14.5.144,470,"Server40","Make night conference difference above choice it.",2023-02-14T03:43:54.185080,db-98.warren.biz,United States,Martineztown,home,General Electric
40.155.150.35,305,"Server95","Response note cost catch stage.",2020-11-04T11:15:31.535209,web-01.harrell-phelps.info,Vietnam,North Meagan,allow,Amazon
165.223.213.226,363,"Server62","Then off avoid stuff low forget foot.",2020-02-05T06:53:20.298556,srv-42.little.com,Germany,Williamside,one,JPMorgan Chase
71.97.207.162,478,"Server17","Green bad price relationship determine information.",2020-01-17T13:25:18.288275,email-56.martin.com,Canada,Alexanderbury,ever,Tesla
188.154.99.66,200,"Server6","Me poor decade often.",2024-08-17T23:49:36.870117,web-14.cook-howard.com,Russia,Kevinberg,prepare,Google
82.17.179.223,453,"Server14","Question former community address beyond all.",2022-12-06T19:49:26.344053,db-23.davies.com,Spain,Lake Johnnyfort,attack,PwC
17.121.114.4,223,"Server92","Focus discussion success behind clearly quality personal.",2020-10-12T01:01:54.414242,desktop-27.ryan-gray.com,Canada,Russelltown,low,Volkswagen
204.218.94.202,362,"Server6","Help hold a two situation.",2023-07-25T11:21:06.650472,desktop-31.strickland-santos.com,Nigeria,East Krista,simply,Amazon
162.175.244.187,332,"Server10","Hold serve arrive just perhaps live anything whatever.",2021-03-01T21:37:13.174143,laptop-36.schroeder.com,Pakistan,East Christian,pattern,IBM
39.147.215.92,241,"Server4","Respond husband marriage administration.",2020-01-12T20:43:50.224832,web-66.jennings.com,South Africa,Barryfort,citizen,Siemens
121.46.200.167,552,"Server10","Which society over.",2024-02-06T05:12:21.118686,email-23.melton-murphy.com,Brazil,Alexanderland,heavy,KPMG
37.185.107.34,510,"Server95","Lawyer red by great rest explain.",2023-07-22T09:39:37.974819,desktop-17.nelson-johnson.info,Kenya,Barbarabury,tend,JPMorgan Chase
27.136.2.254,359,"Server30","Activity pick whole guess several hit.",2020-02-08T09:22:50.820918,laptop-64.mccormick.com,Vietnam,Lake Crystal,note,Oracle
132.91.177.254,279,"Server30","Result least affect.",2021-05-10T05:45:06.499267,web-21.mccarthy.com,South Africa,South Seanhaven,bring,Google
182.220.81.83,413,"Server56","She final structure real between nice.",2023-08-10T14:24:25.200582,srv-01.thomas-brewer.com,Russia,Lake Kevin,or,PwC
110.112.230.126,329,"Server61","Pressure teach tell data large marriage.",2020-12-31T01:26:57.062837,email-78.williams.org,Egypt,Murphytown,product,HSBC
53.118.253.250,462,"Server31","Tax ever enjoy.",2023-11-23T13:24:01.752760,email-76.hernandez.com,Indonesia,Adkinston,deep,HSBC
57.82.82.189,533,"Server99","Interest fish record fact near.",2020-03-27T17:45:10.017086,db-36.hoffman.info,Japan,North Ericshire,trial,General Electric
60.167.58.66,297,"Server92","Whatever sound about several.",2021-12-28T06:18:31.384763,web-86.weeks.net,Russia,Jasonville,and,HSBC
199.180.72.162,407,"Server7","Sell discuss TV live.",2024-11-23T18:58:34.752990,web-11.anderson-willis.biz,United States,New Benjamintown,animal,Samsung
195.136.202.160,363,"Server63","Story sell believe good learn able state relate.",2020-02-02T17:50:49.772306,srv-29.jacobs.info,South Africa,Elizabethstad,phone,BMW
90.94.223.226,269,"Server100","Protect cost physical wrong popular increase response.",2020-06-09T10:34:30.488345,web-01.morris-baker.com,Brazil,Kristinchester,worry,Samsung
101.24.27.170,247,"Server60","Win they crime say career wife within would.",2020-06-26T00:13:47.940927,email-05.hughes.info,United Kingdom,Brownstad,like,HSBC
51.229.41.212,257,"Server45","Space board place almost set ability test.",2023-08-14T21:01:27.922644,lt-65.ray-solis.com,Argentina,East Grantburgh,center,Amazon
141.5.253.248,545,"Server59","Sit under spring return.",2022-12-11T01:45:07.041331,email-13.fischer-hart.com,Pakistan,Haysville,east,Ernst & Young
43.12.177.140,389,"Server49","Plan issue short along.",2022-06-21T21:06:57.271091,laptop-36.morales-reed.biz,Pakistan,Jonesland,protect,IBM
157.167.53.49,275,"Server30","Agency next crime parent yet.",2023-11-14T10:37:34.420938,email-50.walker.com,Israel,West Amy,four,Barclays
16.188.137.146,526,"Server41","Money travel in black ready.",2024-03-09T03:27:24.159357,srv-10.greene.com,South Africa,South Jennifermouth,others,Siemens
49.249.201.131,337,"Server54","Pressure suffer forget state collection.",2024-04-06T15:21:23.493381,web-04.beck.com,India,Thompsonton,answer,IBM
178.165.52.82,372,"Server83","Land audience together protect explain speech computer.",2024-07-14T08:52:36.609246,db-80.scott.com,Italy,Knappbury,surface,Mercedes-Benz
148.87.224.229,202,"Server78","Couple job story community individual event.",2021-08-19T11:59:39.197433,db-28.lewis.com,Indonesia,West Melissaside,whether,Toyota
97.14.31.63,584,"Server62","Trouble between doctor throw record.",2022-12-16T01:29:49.990157,desktop-89.johnson.com,India,Jasonton,nation,JPMorgan Chase
160.195.85.237,392,"Server77","Style south black available successful she western.",2024-05-11T02:27:00.518910,laptop-11.dickson-burns.org,Thailand,Lopezfurt,along,KPMG
132.11.208.103,559,"Server87","Guy protect feeling area concern cost they western.",2023-11-10T12:36:36.320801,email-41.brewer.com,Egypt,South Tina,raise,Accenture
137.202.45.50,399,"Server17","Arm sort stay stock.",2020-03-11T03:21:49.125982,lt-33.smith.com,Turkey,Hallville,office,Siemens
75.106.3.28,480,"Server53","Explain fire everything card letter thing.",2021-06-29T14:40:55.841814,srv-07.reed-chung.com,Germany,Patrickfurt,fact,Deloitte
83.167.251.54,390,"Server78","Source artist as him forget door try.",2023-11-11T01:15:53.755480,laptop-77.frank-harris.com,Vietnam,New Walterburgh,movie,Deloitte
195.171.90.251,209,"Server24","Understand country rock do travel together.",2023-12-01T05:08:24.213217,lt-63.hill-smith.com,Pakistan,Boydshire,attack,Mercedes-Benz
115.203.109.133,450,"Server2","Conference attention key child under.",2023-07-27T03:08:44.456539,email-24.townsend.info,Israel,Smithland,blue,General Electric
64.189.36.25,598,"Server93","Administration picture well structure.",2020-09-14T01:54:09.674057,email-98.butler-johnson.biz,Russia,Obrienland,expert,Sony
221.55.250.74,358,"Server33","Official sound adult per.",2023-03-22T00:19:13.848238,lt-34.morris.com,France,Glennhaven,really,Cisco
65.18.245.131,569,"Server60","Follow authority feeling since make role safe.",2023-09-14T08:10:36.700067,lt-25.cross.com,South Korea,New Antonio,statement,Google
55.200.165.83,598,"Server28","Where involve sure grow.",2021-12-04T03:12:27.315784,desktop-67.perkins.info,Nigeria,New Michael,help,Apple
93.233.51.22,455,"Server25","Meeting almost range shake sense card drug.",2020-05-19T13:14:04.180820,laptop-56.day.net,Australia,West Kylie,month,Apple
118.237.33.169,595,"Server54","Guy far he under.",2020-12-23T05:00:55.532422,lt-91.ward.com,Japan,Keithmouth,something,Deloitte
179.233.242.75,500,"Server47","Indicate PM debate current pull walk defense.",2023-10-31T19:16:13.954680,laptop-67.allen-cross.com,India,Bakerside,far,Ernst & Young
78.168.171.21,451,"Server66","He whom source art.",2021-03-17T17:56:50.058878,web-07.vazquez.com,Germany,North Robert,enjoy,Citigroup
116.152.153.74,489,"Server59","Success face low five office kitchen get.",2021-10-11T19:30:05.347384,desktop-03.harrison-kaufman.com,Argentina,Lake Veronicaborough,give,Citigroup
111.9.248.192,467,"Server27","Morning network painting seek religious owner certainly.",2024-07-25T09:03:47.189648,laptop-24.davis.biz,Germany,Wagnerport,break,Intel
84.129.97.28,404,"Server85","Decision deal training month look.",2023-08-25T06:07:32.097747,srv-53.sanford-sellers.com,South Korea,South Mitchellland,billion,Accenture
39.123.116.66,464,"Server8","Today both list safe data point wish.",2021-04-20T00:20:05.688199,db-35.hernandez.com,Saudi Arabia,Port Kevinberg,bed,Ernst & Young
14.39.248.126,227,"Server5","Believe someone before.",2024-08-26T19:40:53.779003,laptop-05.smith.org,Argentina,Lindamouth,fish,PwC
50.58.212.70,202,"Server86","Decade artist decide wait once sport.",2020-08-17T05:17:48.995049,email-42.rodriguez.com,Thailand,Leahborough,none,Citigroup
88.58.30.23,241,"Server48","City staff fly possible too support.",2021-12-14T00:43:54.812175,lt-02.bell-hopkins.com,Bangladesh,West William,enjoy,Oracle
174.198.93.108,569,"Server77","Fund truth population player I rather.",2022-04-19T14:38:33.665591,lt-62.meyers.info,France,West Mollyview,question,Volkswagen
85.75.243.185,240,"Server72","Through family community local.",2021-07-27T15:08:43.625695,db-09.miller.com,Israel,West Shelby,senior,Oracle
192.128.133.59,594,"Server36","Woman can practice statement dark.",2024-06-21T06:21:27.922552,web-14.palmer.com,Nigeria,Zamorashire,poor,Tesla
2.53.38.83,266,"Server61","Huge first need once financial.",2021-11-13T18:06:10.890009,db-25.chapman.com,Thailand,Port Ebonychester,degree,Siemens
153.179.29.5,330,"Server63","Debate condition career someone.",2020-10-29T15:40:19.713627,desktop-56.dunn.org,Canada,Kathleentown,early,Citigroup
80.169.32.217,257,"Server70","Class wish everything official his.",2021-06-27T06:09:58.421664,email-90.coleman-waller.com,Russia,Holmesside,painting,Mercedes-Benz
134.154.254.111,200,"Server42","Different use week.",2023-02-28T00:55:52.769754,desktop-01.osborne.com,Canada,Isaachaven,world,Huawei
212.72.178.40,549,"Server80","Population nothing alone necessary remain join.",2020-10-29T02:15:32.094774,desktop-93.morris.biz,Chile,Baileymouth,sell,IBM
183.220.232.44,246,"Server38","Blue international not century.",2023-02-13T08:21:44.751972,desktop-40.cuevas.com,Japan,West Eric,process,Mercedes-Benz
130.99.76.12,275,"Server63","Key raise follow occur like local seem.",2022-10-26T20:36:18.523825,laptop-83.banks-orozco.com,Saudi Arabia,Orrport,inside,Google
26.93.90.190,245,"Server1","Since ball west safe save language.",2021-10-07T19:47:50.554632,srv-08.welch.com,Egypt,Matthewbury,watch,Cisco
4.106.106.22,452,"Server13","Then field break reach animal walk movie use.",2023-04-13T18:24:22.462798,lt-49.hayden.com,France,Dylanstad,onto,General Electric
222.144.61.222,492,"Server47","Send card brother friend.",2021-11-28T10:45:37.949077,desktop-99.underwood.org,Canada,Lake Charlesstad,training,Samsung
88.237.203.64,352,"Server73","Quality voice ahead increase.",2024-11-16T21:43:49.297170,desktop-43.sellers-lopez.org,Australia,West Taylor,sound,IBM
155.22.14.242,234,"Server6","Born green their family well policy particularly keep.",2024-12-11T18:23:08.949787,lt-13.moore.com,Australia,South Wayneview,experience,Siemens
64.50.76.98,397,"Server84","Page during standard foot available.",2023-01-17T00:40:28.924953,laptop-49.barton.com,Indonesia,North Stevenborough,upon,IBM
37.170.213.168,298,"Server14","Direction assume identify human sure glass western.",2023-10-29T08:25:36.712184,laptop-42.gross-allen.com,Canada,Laurahaven,less,Mercedes-Benz
205.171.85.204,559,"Server3","World reveal area.",2023-05-29T17:23:37.530051,srv-05.hooper.com,Mexico,Schmidtburgh,campaign,Facebook
161.108.214.29,317,"Server56","Range day during piece think wife seat give.",2021-04-06T16:30:31.925596,db-30.brewer.com,Canada,South Josemouth,we,Barclays
44.220.209.58,477,"Server37","Popular training answer citizen new night of.",2023-12-07T10:09:28.838346,laptop-35.gonzalez-wheeler.com,Argentina,Reynoldsmouth,over,Volkswagen
193.162.11.14,451,"Server83","Moment benefit our institution.",2021-09-27T10:26:17.112509,web-03.duffy.com,Brazil,South Melissa,increase,Intel
89.146.233.68,224,"Server58","Huge mention often apply down rock.",2023-07-16T01:08:58.196853,srv-80.allen-wright.com,Pakistan,Dianebury,soldier,Cisco
116.33.237.16,293,"Server66","Lay group know at machine.",2020-09-15T23:52:43.884602,desktop-97.lopez.com,Kenya,Lake Kevinborough,look,Microsoft
187.113.209.160,570,"Server58","Everything each oil live real head.",2023-04-25T01:30:07.384778,web-71.martinez.com,United States,New Edwardmouth,pay,Microsoft
29.169.182.248,234,"Server44","Entire within our card past stage expect.",2021-06-13T17:44:05.552585,db-85.reynolds.com,Saudi Arabia,Tonyton,serve,Sony
145.49.222.145,364,"Server7","Environment I adult beyond respond.",2022-03-15T05:10:44.231096,db-08.lucero.com,Turkey,Lake Mark,situation,PwC
209.116.140.147,446,"Server63","Four subject certain similar language challenge nation.",2022-01-04T18:54:26.214156,email-88.le-wilkins.com,Nigeria,Lake David,it,General Electric
8.184.223.152,484,"Server70","Cultural safe future responsibility value.",2020-10-08T00:35:38.962862,srv-39.hernandez.com,United States,Lake Mariaton,difference,IBM
15.90.218.167,471,"Server65","Cost sport bank plan every lawyer another catch.",2022-01-13T22:46:57.889849,srv-85.barry.com,Vietnam,Murphystad,speech,PwC
194.194.165.40,316,"Server95","Kid chair the military minute.",2023-10-23T03:06:58.213007,laptop-15.morrow-turner.com,Italy,Lake Michael,behavior,Accenture
22.118.13.103,432,"Server39","Rather question even life major picture.",2021-09-29T10:30:33.293133,lt-71.underwood-lewis.net,Mexico,Port Michael,leader,Barclays
141.61.97.72,369,"Server90","Thought detail hard yet share reality.",2024-07-05T00:25:17.609334,db-45.baker.net,Brazil,Jayton,population,Microsoft
108.99.196.16,258,"Server86","Someone young foot seven.",2023-04-09T20:49:18.910106,desktop-09.shannon.org,Mexico,Jonathanstad,cell,Google
60.131.64.212,553,"Server26","Suddenly individual laugh within bank.",2022-07-14T06:53:43.886674,laptop-20.jones.com,Kenya,West Ian,data,Cisco
132.47.2.96,444,"Server84","Return source your century play.",2020-01-25T09:48:18.675435,email-86.hayes.com,Nigeria,Port Penny,pull,Amazon
193.203.163.7,484,"Server22","Member against miss professional.",2020-06-07T05:07:15.072989,web-23.hendricks.com,Spain,North Nicole,natural,Morgan Stanley
136.73.12.164,520,"Server55","Religious staff director that remember old.",2021-08-22T22:19:21.243950,db-64.chandler.com,Chile,East Toddland,thing,Siemens
165.80.36.202,495,"Server36","Our man recently he key show.",2020-09-22T13:21:03.071927,db-19.bailey.com,South Africa,Juliemouth,respond,IBM
167.90.14.136,328,"Server62","Eat city certainly particularly approach against amount.",2024-07-01T11:53:23.809783,email-55.harrison.org,Pakistan,East James,in,Volkswagen
82.100.130.77,281,"Server11","Its center charge stay.",2022-09-11T15:56:20.513338,web-69.buck.com,Kenya,Michaelfurt,audience,Toyota
82.186.87.216,481,"Server68","State war feel above have data threat include.",2023-08-24T02:06:44.928268,db-19.bowman.biz,Pakistan,East Tony,dream,Ernst & Young
153.105.179.216,512,"Server7","Expect goal receive test place lawyer.",2021-12-09T02:13:06.391961,lt-94.delacruz.com,Germany,Rowetown,better,Citigroup
160.102.83.113,564,"Server34","Production yeah physical it bill cultural prevent.",2021-02-20T04:52:47.003666,srv-65.vazquez.net,Israel,Richardsonside,also,Mercedes-Benz
185.113.2.250,238,"Server12","Politics describe structure both only.",2022-01-19T04:12:26.613792,srv-07.krueger-green.com,China,West Sandra,describe,PwC
141.4.46.90,500,"Server52","Himself should decade follow believe quickly east.",2021-10-01T00:00:49.580540,db-65.watson-lopez.info,China,Danielleville,perform,HSBC
55.238.245.164,331,"Server5","Score break court billion around wrong bar.",2023-01-25T02:36:55.613198,desktop-14.ryan-stephenson.com,United Arab Emirates,Alexville,two,Samsung
142.224.2.242,582,"Server33","Make specific program mean three enter.",2024-06-30T05:48:30.623196,web-31.nguyen.com,Nigeria,South Stephanie,really,Morgan Stanley
167.150.174.140,394,"Server78","Wrong white next expect live both word.",2020-10-18T06:15:01.509894,lt-98.patton-fischer.biz,Russia,West Timothy,positive,Amazon
35.200.91.58,273,"Server41","Evening opportunity option everybody coach prevent.",2023-08-24T22:49:26.849978,db-38.cox.info,Germany,West Amber,stop,IBM
116.200.195.150,468,"Server27","Paper step court effect.",2023-05-06T14:29:04.029365,web-53.smith-silva.org,South Africa,West Tiffany,system,Sony
67.70.247.78,355,"Server85","Special list close rule.",2023-03-21T14:40:38.911694,db-61.delacruz.info,South Africa,Markhaven,say,KPMG
191.90.248.154,225,"Server10","A ask election than.",2021-06-07T13:31:13.155208,desktop-36.white-phillips.info,South Korea,Schultzborough,community,Barclays
13.173.38.77,319,"Server86","Probably executive however.",2023-07-08T09:37:59.085420,email-29.walker-torres.biz,India,Elliottmouth,best,IBM
179.90.46.199,395,"Server81","Free them state issue.",2021-10-25T16:15:55.549487,web-26.jordan.org,Thailand,Cynthiaberg,morning,Tesla
194.154.110.88,252,"Server1","Add police clearly at.",2021-05-08T13:16:55.576436,desktop-63.grant.info,Vietnam,Lake Pamela,surface,Oracle
172.225.66.37,302,"Server47","Attention traditional color ahead four leader student.",2021-05-24T17:06:58.149638,laptop-49.stanley.info,South Africa,North Mary,entire,Tesla
146.216.16.240,253,"Server62","Civil resource beat account.",2021-07-12T00:36:02.228971,desktop-92.richardson.com,India,South Janice,rock,Siemens
149.132.38.212,302,"Server88","Happy weight Mr always.",2020-04-29T15:35:37.975819,lt-91.brown.com,China,Jonton,cold,Morgan Stanley
196.209.120.85,503,"Server49","Son beautiful care begin month.",2024-09-02T09:53:40.228692,lt-68.newman.com,Russia,Hurststad,natural,Accenture
192.109.139.197,328,"Server5","Property seek rise past likely local.",2021-04-16T10:00:33.657807,web-67.bell-elliott.com,Vietnam,Kellerstad,risk,Apple
